ء	ʔ
الحسكة	aː l ħ s k a
الحسيمة	aː l ħ s i m a
الخرطوم	aː l x r tˤ u m
الخمس	aː l x m s
الخميس	aː l x m i s
الخميسات	aː l x m i s aː t
الدانوب	aː l d aː n u b
الدجاجة	aː l d dʒ aː dʒ a
الدنمارك	aː l d n m aː r k
الدوحة	aː l d u ħ a
الذي	aː l ð iː
الرباط	aː l r b aː tˤ
الرباط	aː l r b aː tˤ
الرحمن	aː l r ħ m n
الرشاء	aː l r ʃ aː ʔ
الرضا	aː l r dˤ aː
الرقة	aː l r q a
الرياض	aː l r i aː dˤ
الزرقاء	aː l z r q aː ʔ
الزهرة	aː l z h r a
السبت	aː l s b t
السعودية	aː l s ʕ u d i a
السعودية	aː l s ʕ u d i a
السفن	aː l s f n
السلفادور	aː l s l f aː d u r
السلفادور	aː l s l f aː d u r
السند	aː l s n d
السنغال	aː l s n ɣ aː l
السودان	aː l s u d aː n
السويد	aː l s u j d
السويس	aː l s u j s
الشارقة	aː l ʃ aː r q a
الشارقة	aː l ʃ aː r q a
الشافعي	aː l ʃ aː f ʕ iː
الصربية	aː l sˤ r b i a
الصومال	aː l sˤ u m aː l
الصويرة	aː l sˤ u j r a
الصين	aː l sˤ i n
العاصي	aː l ʕ aː sˤ iː
العبرية	aː l ʕ b r i a
العرائش	aː l ʕ r aː ʔ i ʃ
العراق	aː l ʕ r aː q
العربية	aː l ʕ r b i a
العزى	aː l ʕ z aː
العفو	aː l ʕ f uː
العفو	aː l ʕ f uː
العنقاء	aː l ʕ n q aː ʔ
الغابون	aː l ɣ aː b u n
الغابون	aː l ɣ aː b u n
الغابون	aː l ɣ aː b u n
الغير	aː l ɣ i r
الفاتيكان	aː l f aː t i k aː n
الفاتيكان	aː l f aː t i k aː n
الفاطر	aː l f aː tˤ r
الفرات	aː l f r aː t
الفصحى	aː l f sˤ ħ aː
الفلبين	aː l f l b i n
القاعدة	aː l q aː ʕ d a
القاهرة	aː l q aː h r a
القبلتان	aː l q b l t aː n
القبلتين	aː l q b l t i n
القدس	aː l q d s
القرآن	aː l q r ʔ aː n
القرآنية	aː l q r ʔ aː n i a
القرم	aː l q r m
القسطنطينية	aː l q s tˤ n tˤ i n i a
القطيف	aː l q tˤ i f
القطيف	aː l q tˤ i f
القنت	aː l q n t
القنيطرة	aː l q n i tˤ r a
القوقاز	aː l q u q aː z
القيروان	aː l q i r u aː n
الكاميرون	aː l k aː m i r u n
الكرملين	aː l k r m l i n
الكرملين	aː l k r m l i n
الكرملين	aː l k r m l i n
الكعبة	aː l k ʕ b a
الكنية	aː l k n i a
الكونغو	aː l k u n ɣ uː
الكونغو	aː l k u n ɣ uː
الكونغو	aː l k u n ɣ uː
الكويت	aː l k u j t
اللات	aː l l aː t
اللاذقية	aː l l aː ð q i a
الله	aː l l h
الله	aː l l h
اللهم	aː l l h m
المثنى	aː l m θ n aː
المجر	aː l m dʒ r
المحرض	aː l m ħ r dˤ
المحمدية	aː l m ħ m d i a
المخا	aː l m x aː
المخلص	aː l m x l sˤ
المدائن	aː l m d aː ʔ i n
المدينة	aː l m d i n a
المرء	aː l m r ʔ
المريخ	aː l m r i x
المسيح	aː l m s i ħ
المشتري	aː l m ʃ t r iː
المصري	aː l m sˤ r iː
المعتزلة	aː l m ʕ t z l a
المغرب	aː l m ɣ r b
المكسيك	aː l m k s i k
المنامة	aː l m n aː m a
المنستير	aː l m n s t i r
الموصل	aː l m u sˤ l
الناصرة	aː l n aː sˤ r a
الناصرة	aː l n aː sˤ r a
الناظور	aː l n aː ðˤ u r
النجف	aː l n dʒ f
النرويج	aː l n r u j dʒ
النمسا	aː l n m s aː
النمسا	aː l n m s aː
النوبة	aː l n u b a
النيجر	aː l n i dʒ r
الهند	aː l h n d
الوداع	aː l u d aː ʕ
اليابان	aː l i aː b aː n
اليرموك	aː l i r m u k
اليسع	aː l i s ʕ
اليمن	aː l i m n
اليوم	aː l i w m
اليونان	aː l i w n aː n
امتاز	aː m t aː z
امتحان	aː m t ħ aː n
امتحن	aː m t ħ n
امترى	aː m t r aː
امتطى	aː m t tˤ aː
امتعاض	aː m t ʕ aː dˤ
امتعض	aː m t ʕ dˤ
امتن	aː m t n
امتنع	aː m t n ʕ
امتياز	aː m t i aː z
امرأ	aː m r ʔ a
امرأ	aː m r ʔ a
امرأ	aː m r ʔ a
امرأة	aː m r ʔ a a
امرؤ	aː m r ʔ u
امناء	aː m n aː ʔ
انبث	aː n b θ
انبث	aː n b θ
انبثق	aː n b θ q
انبساط	aː n b s aː tˤ
انبطح	aː n b tˤ ħ
انبعث	aː n b ʕ θ
انبغى	aː n b ɣ aː
انبل	aː n b l
انتأى	aː n t ʔ a aː
انتباه	aː n t b aː h
انتبه	aː n t b h
انتحال	aː n t ħ aː l
انتحب	aː n t ħ b
انتحل	aː n t ħ l
انتخاب	aː n t x aː b
انتخب	aː n t x b
انتزع	aː n t z ʕ
انتشار	aː n t ʃ aː r
انتشق	aː n t ʃ q
انتصاب	aː n t sˤ aː b
انتصار	aː n t sˤ aː r
انتصب	aː n t sˤ b
انتظار	aː n t ðˤ aː r
انتظام	aː n t ðˤ aː m
انتظر	aː n t ðˤ r
انتظم	aː n t ðˤ m
انتعش	aː n t ʕ ʃ
انتفاضة	aː n t f aː dˤ a
انتفاع	aː n t f aː ʕ
انتفخ	aː n t f x
انتفع	aː n t f ʕ
انتفى	aː n t f aː
انتقاء	aː n t q aː ʔ
انتقائي	aː n t q aː ʔ i iː
انتقائية	aː n t q aː ʔ i i a
انتقاض	aː n t q aː dˤ
انتقال	aː n t q aː l
انتقام	aː n t q aː m
انتقد	aː n t q d
انتقض	aː n t q dˤ
انتقل	aː n t q l
انتقم	aː n t q m
انتقى	aː n t q aː
انتكس	aː n t k s
انتماء	aː n t m aː ʔ
انتمى	aː n t m aː
انتهاز	aː n t h aː z
انتهاك	aː n t h aː k
انتهز	aː n t h z
انتهك	aː n t h k
انتهى	aː n t h aː
انثقب	aː n θ q b
انجذاب	aː n dʒ ð aː b
انجراف	aː n dʒ r aː f
انجرف	aː n dʒ r f
انحاز	aː n ħ aː z
انحرق	aː n ħ r q
انحصار	aː n ħ sˤ aː r
انحصر	aː n ħ sˤ r
انحط	aː n ħ tˤ
انحناء	aː n ħ n aː ʔ
انحياز	aː n ħ i aː z
انخرط	aː n x r tˤ
انخفاض	aː n x f aː dˤ
انخفض	aː n x f dˤ
انخلع	aː n x l ʕ
اندحار	aː n d ħ aː r
اندفاع	aː n d f aː ʕ
اندفاق	aː n d f aː q
اندفع	aː n d f ʕ
اندفق	aː n d f q
اندلاق	aː n d l aː q
اندلع	aː n d l ʕ
اندلق	aː n d l q
اندمج	aː n d m dʒ
اندمل	aː n d m l
اندهاش	aː n d h aː ʃ
اندهش	aː n d h ʃ
انزعاج	aː n z ʕ aː dʒ
انزواء	aː n z u aː ʔ
انسجام	aː n s dʒ aː m
انسحب	aː n s ħ b
انسحق	aː n s ħ q
انسداد	aː n s d aː d
انسكب	aː n s k b
انسل	aː n s l
انسلخ	aː n s l x
انشغال	aː n ʃ ɣ aː l
انشق	aː n ʃ q
انشقاق	aː n ʃ q aː q
انشوى	aː n ʃ u aː
انصبن	aː n sˤ b n
انصرف	aː n sˤ r f
انضباط	aː n dˤ b aː tˤ
انضجع	aː n dˤ dʒ ʕ
انضم	aː n dˤ m
انطباع	aː n tˤ b aː ʕ
انطباق	aː n tˤ b aː q
انطبع	aː n tˤ b ʕ
انطبق	aː n tˤ b q
انطلق	aː n tˤ l q
انطواء	aː n tˤ u aː ʔ
انطوائي	aː n tˤ u aː ʔ i iː
انعدم	aː n ʕ d m
انعدى	aː n ʕ d aː
انعطف	aː n ʕ tˤ f
انعقاد	aː n ʕ q aː d
انعكاس	aː n ʕ k aː s
انفأى	aː n f ʔ a aː
انفتاح	aː n f t aː ħ
انفتح	aː n f t ħ
انفجر	aː n f dʒ r
انفرادي	aː n f r aː d iː
انفرث	aː n f r θ
انفرط	aː n f r tˤ
انفعال	aː n f ʕ aː l
انفك	aː n f k
انفلاق	aː n f l aː q
انفلق	aː n f l q
انقباض	aː n q b aː dˤ
انقبض	aː n q b dˤ
انقد	aː n q d
انقراض	aː n q r aː dˤ
انقرض	aː n q r dˤ
انقسام	aː n q s aː m
انقسم	aː n q s m
انقشع	aː n q ʃ ʕ
انقضاض	aː n q dˤ aː dˤ
انقضى	aː n q dˤ aː
انقطع	aː n q tˤ ʕ
انقلاب	aː n q l aː b
انقلب	aː n q l b
انقلع	aː n q l ʕ
انكب	aː n k b
انكتاب	aː n k t aː b
انكتب	aː n k t b
انكمش	aː n k m ʃ
انهار	aː n h aː r
انهمر	aː n h m r
انهمك	aː n h m k
اهتدى	aː h t d aː
اهتز	aː h t z
اهتزاز	aː h t z aː z
اهتم	aː h t m
ب	b
ب	b
ب	b
بأس	b ʔ a s
بأساء	b ʔ a s aː ʔ
بؤر	b ʔ u r
بؤرة	b ʔ u r a
بؤس	b ʔ u s
بؤس	b ʔ u s
بئر	b ʔ i r
بئس	b ʔ i s
بئسما	b ʔ i s m aː
باء	b aː ʔ
باء	b aː ʔ
بائس	b aː ʔ i s
بائع	b aː ʔ i ʕ
بائن	b aː ʔ i n
باب	b aː b
بابا	b aː b aː
بابل	b aː b l
بابلي	b aː b l iː
بابور	b aː b u r
بابونج	b aː b u n dʒ
باح	b aː ħ
باحث	b aː ħ θ
باحث	b aː ħ θ
باخوم	b aː x u m
باد	b aː d
باد	b aː d
بادية	b aː d i a
باذنجان	b aː ð n dʒ aː n
بارا	b aː r aː
بارا	b aː r aː
باراغواي	b aː r aː ɣ u aː iː
بارد	b aː r d
بارز	b aː r z
بارز	b aː r z
بارزد	b aː r z d
بارزذ	b aː r z ð
بارع	b aː r ʕ
بارك	b aː r k
بارم	b aː r m
باروق	b aː r u q
بارون	b aː r u n
بارونية	b aː r u n i a
باريس	b aː r i s
باريس	b aː r i s
باز	b aː z
بازار	b aː z aː r
بازنقر	b aː z n q r
بازنقر	b aː z n q r
بازهر	b aː z h r
بازوكة	b aː z u k a
باس	b aː s
باستا	b aː s t aː
باستا	b aː s t aː
باسط	b aː s tˤ
باسل	b aː s l
باسور	b aː s u r
باسيليوس	b aː s i l i w s
باشا	b aː ʃ aː
باشق	b aː ʃ q
باشق	b aː ʃ q
باص	b aː sˤ
باصور	b aː sˤ u r
باضع	b aː dˤ ʕ
باطس	b aː tˤ s
باطلا	b aː tˤ l aː
باطن	b aː tˤ n
باطني	b aː tˤ n iː
باطية	b aː tˤ i a
باع	b aː ʕ
باغت	b aː ɣ t
باقة	b aː q a
باقلاء	b aː q l aː ʔ
باقلاء	b aː q l aː ʔ
باقلى	b aː q l aː
باقي	b aː q iː
باكر	b aː k r
باكستان	b aː k s t aː n
باكستاني	b aː k s t aː n iː
باكو	b aː k uː
باكورة	b aː k u r a
بال	b aː l
بال	b aː l
بالاو	b aː l aː uː
بالة	b aː l a
بالتسي	b aː l t s iː
بالتوفيق	b aː l t u f i q
بالضبط	b aː l dˤ b tˤ
بالعكس	b aː l ʕ k s
بالغ	b aː l ɣ
بالغ	b aː l ɣ
بالغ	b aː l ɣ
بالفعل	b aː l f ʕ l
بالوعات	b aː l u ʕ aː t
بالون	b aː l u n
باليه	b aː l i h
بامية	b aː m i a
بانثيون	b aː n θ i w n
بانثيون	b aː n θ i w n
بانثيون	b aː n θ i w n
باهت	b aː h t
باهل	b aː h l
بايع	b aː j ʕ
ببر	b b r
ببنودة	b b n u d a
بتاتا	b t aː t aː
بتاتا	b t aː t aː
بتة	b t a
بتصرف	b t sˤ r f
بتع	b t ʕ
بتليس	b t l i s
بتول	b t u l
بتولا	b t u l aː
بتولية	b t u l i a
بتيل	b t i l
بثرات	b θ r aː t
بثن	b θ n
بثور	b θ u r
بجادق	b dʒ aː d q
بجادي	b dʒ aː d iː
بجادي	b dʒ aː d iː
بجاذق	b dʒ aː ð q
بجاذي	b dʒ aː ð iː
بجح	b dʒ ħ
بجح	b dʒ ħ
بجد	b dʒ d
بجوار	b dʒ u aː r
بجول	b dʒ u l
بجون	b dʒ u n
بح	b ħ
بحاح	b ħ aː ħ
بحار	b ħ aː r
بحث	b ħ θ
بحث	b ħ θ
بحر	b ħ r
بحر	b ħ r
بحر	b ħ r
بحر	b ħ r
بحر	b ħ r
بحران	b ħ r aː n
بحري	b ħ r iː
بحرين	b ħ r i n
بحرين	b ħ r i n
بحريني	b ħ r i n iː
بحلق	b ħ l q
بحيرة	b ħ i r a
بخاخ	b x aː x
بخت	b x t
بخت	b x t
بختري	b x t r iː
بخشيش	b x ʃ i ʃ
بخص	b x sˤ
بخص	b x sˤ
بخير	b x i r
بخيل	b x i l
بدأ	b d ʔ a
بدا	b d aː
بداية	b d aː j a
بدخش	b d x ʃ
بدر	b d r
بدعة	b d ʕ a
بدلات	b d l aː t
بدلة	b d l a
بدليس	b d l i s
بدن	b d n
بدنة	b d n a
بدني	b d n iː
بدهي	b d h iː
بدون	b d u n
بدوي	b d u iː
بديع	b d i ʕ
بديهي	b d i h iː
بذ	b ð
بذاءة	b ð aː ʔ a
بذج	b ð dʒ
بذج	b ð dʒ
بذرة	b ð r a
بذرقطونا	b ð r q tˤ u n aː
بذرقطونا	b ð r q tˤ u n aː
بذريات	b ð r i aː t
بذلة	b ð l a
بذلة	b ð l a
برأ	b r ʔ a
برئ	b r ʔ i
براءة	b r aː ʔ a
براتا	b r aː t aː
برار	b r aː r
براز	b r aː z
براشوت	b r aː ʃ u t
براعة	b r aː ʕ a
براق	b r aː q
براني	b r aː n iː
برانية	b r aː n i a
براهمة	b r aː h m a
براية	b r aː j a
براية	b r aː j a
براين	b r aː j n
بربادوس	b r b aː d u s
بربادوس	b r b aː d u s
بربادوس	b r b aː d u s
بربادوس	b r b aː d u s
بربارة	b r b aː r a
برباريس	b r b aː r i s
بربخ	b r b x
بربري	b r b r iː
بربرية	b r b r i a
بربير	b r b i r
برتقال	b r t q aː l
برتقال	b r t q aː l
برتقالي	b r t q aː l iː
برثولماوس	b r θ u l m aː w s
برج	b r dʒ
برج	b r dʒ
برج	b r dʒ
برجار	b r dʒ aː r
برجل	b r dʒ l
برح	b r ħ
برح	b r ħ
برح	b r ħ
بردزبة	b r d z b a
بردعة	b r d ʕ a
بردقوش	b r d q u ʃ
بردي	b r d iː
بردي	b r d iː
برذعة	b r ð ʕ a
برذون	b r ð u n
برر	b r r
برز	b r z
برساوشان	b r s aː w ʃ aː n
برسياوشان	b r s i aː w ʃ aː n
برسياوشان	b r s i aː w ʃ aː n
برسيم	b r s i m
برشام	b r ʃ aː m
برشام	b r ʃ aː m
برشاوشان	b r ʃ aː w ʃ aː n
برشلونة	b r ʃ l u n a
برشلوني	b r ʃ l u n iː
برشومي	b r ʃ u m iː
برشياوشان	b r ʃ i aː w ʃ aː n
برشياوشان	b r ʃ i aː w ʃ aː n
برشيد	b r ʃ i d
برص	b r sˤ
برطانية	b r tˤ aː n i a
برطانية	b r tˤ aː n i a
برعم	b r ʕ m
برعم	b r ʕ m
برغش	b r ɣ ʃ
برغوث	b r ɣ u θ
برغي	b r ɣ iː
برق	b r q
برق	b r q
برقوق	b r q u q
برقوق	b r q u q
برقية	b r q i a
بركار	b r k aː r
بركان	b r k aː n
بركان	b r k aː n
بركان	b r k aː n
بركان	b r k aː n
بركاني	b r k aː n iː
بركة	b r k a
بركة	b r k a
بركة	b r k a
بركري	b r k r iː
برلمان	b r l m aː n
برلماني	b r l m aː n iː
برلين	b r l i n
برلين	b r l i n
برم	b r m
برم	b r m
برم	b r m
برمائي	b r m aː ʔ i iː
برمائيات	b r m aː ʔ i i aː t
برمة	b r m a
برمج	b r m dʒ
برميل	b r m i l
برميل	b r m i l
برن	b r n
برن	b r n
برن	b r n
برنامج	b r n aː m dʒ
برني	b r n iː
برني	b r n iː
برنية	b r n i a
برنية	b r n i a
برنيق	b r n i q
برنيق	b r n i q
برهان	b r h aː n
برهة	b r h a
برواز	b r u aː z
بروتستانتي	b r u t s t aː n t iː
بروتستانتي	b r u t s t aː n t iː
بروتون	b r u t u n
برودة	b r u d a
بروكسل	b r u k s l
بروكسل	b r u k s l
بروليتاري	b r u l i t aː r iː
بروليتاري	b r u l i t aː r iː
بروليتاريا	b r u l i t aː r i aː
بروليتاريا	b r u l i t aː r i aː
بروناي	b r u n aː iː
بري	b r iː
بريد	b r i d
بريدي	b r i d iː
بريطاني	b r i tˤ aː n iː
بريطاني	b r i tˤ aː n iː
بريمة	b r i m a
بريمة	b r i m a
برينة	b r i n a
برينة	b r i n a
بزاز	b z aː z
بزاق	b z aː q
بزاقة	b z aː q a
بزرقطونا	b z r q tˤ u n aː
بزرقطونا	b z r q tˤ u n aː
بزغ	b z ɣ
بزق	b z q
بزق	b z q
بزقة	b z q a
بزل	b z l
بزل	b z l
بزم	b z m
بس	b s
بس	b s
بساط	b s aː tˤ
بساطة	b s aː tˤ a
بسالة	b s aː l a
بسام	b s aː m
بسباس	b s b aː s
بسباس	b s b aː s
بسباسة	b s b aː s a
بسباسة	b s b aː s a
بسبايج	b s b aː j dʒ
بسبب	b s b b
بستان	b s t aː n
بستنة	b s t n a
بستو	b s t uː
بستوقة	b s t u q a
بسد	b s d
بسد	b s d
بسد	b s d
بسط	b s tˤ
بسفايج	b s f aː j dʒ
بسكرة	b s k r a
بسكويت	b s k u j t
بسكويت	b s k u j t
بسمة	b s m a
بسملة	b s m l a
بش	b ʃ
بش	b ʃ
بشار	b ʃ aː r
بشار	b ʃ aː r
بشرة	b ʃ r a
بشرى	b ʃ r aː
بشري	b ʃ r iː
بشرية	b ʃ r i a
بشع	b ʃ ʕ
بشملة	b ʃ m l a
بشناق	b ʃ n aː q
بشناقي	b ʃ n aː q iː
بشندي	b ʃ n d iː
بشنونة	b ʃ n u n a
بشوش	b ʃ u ʃ
بشير	b ʃ i r
بشيرة	b ʃ i r a
بصارة	b sˤ aː r a
بصريات	b sˤ r i aː t
بصق	b sˤ q
بصق	b sˤ q
بصقة	b sˤ q a
بصل	b sˤ l
بصلي	b sˤ l iː
بصير	b sˤ i r
بصيرة	b sˤ i r a
بضاعة	b dˤ aː ʕ a
بضع	b dˤ ʕ
بضعة	b dˤ ʕ a
بطء	b tˤ ʔ
بطء	b tˤ ʔ
بطؤ	b tˤ ʔ u
بطاء	b tˤ aː ʔ
بطارخ	b tˤ aː r x
بطارخ	b tˤ aː r x
بطارقة	b tˤ aː r q a
بطاريات	b tˤ aː r i aː t
بطارية	b tˤ aː r i a
بطاريق	b tˤ aː r i q
بطاطا	b tˤ aː tˤ aː
بطاطس	b tˤ aː tˤ s
بطاقة	b tˤ aː q a
بطالة	b tˤ aː l a
بطالة	b tˤ aː l a
بطانة	b tˤ aː n a
بطة	b tˤ a
بطرخ	b tˤ r x
بطرس	b tˤ r s
بطرك	b tˤ r k
بطروخ	b tˤ r u x
بطريركية	b tˤ r i r k i a
بطريك	b tˤ r i k
بطلاقة	b tˤ l aː q a
بطلاقة	b tˤ l aː q a
بطليوس	b tˤ l i w s
بطم	b tˤ m
بطن	b tˤ n
بطن	b tˤ n
بطن	b tˤ n
بطن	b tˤ n
بطنة	b tˤ n a
بطولة	b tˤ u l a
بطولة	b tˤ u l a
بطيء	b tˤ i ʔ
بظر	b ðˤ r
بعث	b ʕ θ
بعث	b ʕ θ
بعثة	b ʕ θ a
بعثران	b ʕ θ r aː n
بعثي	b ʕ θ iː
بعدما	b ʕ d m aː
بعر	b ʕ r
بعر	b ʕ r
بعض	b ʕ dˤ
بعضا	b ʕ dˤ aː
بعل	b ʕ l
بعلبك	b ʕ l b k
بعلبك	b ʕ l b k
بعلبك	b ʕ l b k
بعلة	b ʕ l a
بعوض	b ʕ u dˤ
بعيثران	b ʕ i θ r aː n
بعيثران	b ʕ i θ r aː n
بعيد	b ʕ i d
بعيد	b ʕ i d
بعير	b ʕ i r
بغاء	b ɣ aː ʔ
بغتة	b ɣ t a
بغتة	b ɣ t a
بغداد	b ɣ d aː d
بغرير	b ɣ r i r
بغل	b ɣ l
بغلة	b ɣ l a
بغي	b ɣ iː
بغية	b ɣ i a
بغيض	b ɣ i dˤ
بفضل	b f dˤ l
بقاع	b q aː ʕ
بقالة	b q aː l a
بقبق	b q b q
بقجة	b q dʒ a
بقدونس	b q d u n s
بقدونس	b q d u n s
بقر	b q r
بقرة	b q r a
بقريات	b q r i aː t
بقس	b q s
بقس	b q s
بقسماط	b q s m aː tˤ
بقشة	b q ʃ a
بقشيش	b q ʃ i ʃ
بقص	b q sˤ
بقص	b q sˤ
بقع	b q ʕ
بقعة	b q ʕ a
بقل	b q l
بقلاوة	b q l aː w a
بقي	b q iː
بقية	b q i a
بكارة	b k aː r a
بكارج	b k aː r dʒ
بكة	b k a
بكتيريا	b k t i r i aː
بكرج	b k r dʒ
بكورية	b k u r i a
بكى	b k aː
بكى	b k aː
بكية	b k i a
بكين	b k i n
بكين	b k i n
بلادونا	b l aː d u n aː
بلاذر	b l aː ð r
بلاذر	b l aː ð r
بلاستيك	b l aː s t i k
بلاستيكي	b l aː s t i k iː
بلاعة	b l aː ʕ a
بلاغ	b l aː ɣ
بلاغة	b l aː ɣ a
بلان	b l aː n
بلاهة	b l aː h a
بلة	b l a
بلة	b l a
بلجيكا	b l dʒ i k aː
بلجيكا	b l dʒ i k aː
بلجيكا	b l dʒ i k aː
بلجيكا	b l dʒ i k aː
بلجيكي	b l dʒ i k iː
بلخ	b l x
بلخش	b l x ʃ
بلد	b l d
بلدة	b l d a
بلس	b l s
بلس	b l s
بلس	b l s
بلس	b l s
بلس	b l s
بلشون	b l ʃ u n
بلطة	b l tˤ a
بلطجي	b l tˤ dʒ iː
بلطي	b l tˤ iː
بلعوم	b l ʕ u m
بلغاري	b l ɣ aː r iː
بلغاريا	b l ɣ aː r i aː
بلغاريا	b l ɣ aː r i aː
بلغم	b l ɣ m
بلغمي	b l ɣ m iː
بلقن	b l q n
بلكفة	b l k f a
بلل	b l l
بلل	b l l
بلنسية	b l n s i a
بلوة	b l u a
بلوة	b l u a
بلوة	b l u a
بلوتو	b l u t uː
بلور	b l u r
بلور	b l u r
بلوط	b l u tˤ
بلوطة	b l u tˤ a
بليج	b l i dʒ
بليج	b l i dʒ
بليحا	b l i ħ aː
بليحاء	b l i ħ aː ʔ
بليحة	b l i ħ a
بليد	b l i d
بليز	b l i z
بليغ	b l i ɣ
بليلة	b l i l a
بليلج	b l i l dʒ
بمن	b m n
بمناسبة	b m n aː s b a
بموجب	b m u dʒ b
بن	b n
بن	b n
بن	b n
بن	b n
بناء	b n aː ʔ
بناء	b n aː ʔ
بنان	b n aː n
بناية	b n aː j a
بنايوس	b n aː j w s
بنة	b n a
بنة	b n a
بنت	b n t
بنت	b n t
بنت	b n t
بنت	b n t
بنت	b n t
بنجابية	b n dʒ aː b i a
بنجر	b n dʒ r
بنجلاديش	b n dʒ l aː d i ʃ
بنجنكشت	b n dʒ n k ʃ t
بنجنكشت	b n dʒ n k ʃ t
بند	b n d
بندر	b n d r
بندق	b n d q
بندق	b n d q
بندقاني	b n d q aː n iː
بندقية	b n d q i a
بندورة	b n d u r a
بنزين	b n z i n
بنزين	b n z i n
بنسلفينيا	b n s l f i n i aː
بنش	b n ʃ
بنش	b n ʃ
بنطال	b n tˤ aː l
بنغلاديش	b n ɣ l aː d i ʃ
بنغلاديش	b n ɣ l aː d i ʃ
بنفسج	b n f s dʒ
بنفسجي	b n f s dʒ iː
بنك	b n k
بنكرياس	b n k r i aː s
بنكنوت	b n k n u t
بنكنوت	b n k n u t
بنما	b n m aː
بنو	b n uː
بنى	b n aː
بني	b n iː
بنين	b n i n
بنين	b n i n
بهاء	b h aː ʔ
بهائي	b h aː ʔ i iː
بهار	b h aː r
بهار	b h aː r
بهجة	b h dʒ a
بهر	b h r
بهرج	b h r dʒ
بهشية	b h ʃ i a
بهلوان	b h l u aː n
بهلول	b h l u l
بهمن	b h m n
بهو	b h uː
بهيج	b h i dʒ
بهيجة	b h i dʒ a
بهيم	b h i m
بهيمة	b h i m a
بواب	b u aː b
بوابة	b u aː b a
بوابة	b u aː b a
بواسير	b u aː s i r
بواكير	b u aː k i r
بواليع	b u aː l i ʕ
بوان	b u aː n
بوب	b u b
بوب	b u b
بوتاسيوم	b u t aː s i w m
بوتان	b u t aː n
بوتين	b u t i n
بوتيني	b u t i n iː
بوتينية	b u t i n i a
بوجة	b u dʒ a
بوخارست	b u x aː r s t
بودابست	b u d aː b s t
بوذا	b u ð aː
بوذي	b u ð iː
بوذية	b u ð i a
بورانية	b u r aː n i a
بورتسودان	b u r t s u d aː n
بورتوريكو	b u r t u r i k uː
بورتوريكو	b u r t u r i k uː
بورسودان	b u r s u d aː n
بورصة	b u r sˤ a
بورصة	b u r sˤ a
بورفؤاد	b u r f ʔ u aː d
بورما	b u r m aː
بورندي	b u r n d iː
بوروندي	b u r u n d iː
بوري	b u r iː
بوري	b u r iː
بوزون	b u z u n
بوزيدان	b u z i d aː n
بوزيدان	b u z i d aː n
بوزيدان	b u z i d aː n
بوسان	b u s aː n
بوسة	b u s a
بوسة	b u s a
بوسة	b u s a
بوسكورة	b u s k u r a
بوصة	b u sˤ a
بوصلة	b u sˤ l a
بوصلة	b u sˤ l a
بوصلة	b u sˤ l a
بوصلة	b u sˤ l a
بوصلة	b u sˤ l a
بوصلة	b u sˤ l a
بوصير	b u sˤ i r
بوط	b u tˤ
بوغاز	b u ɣ aː z
بوق	b u q
بوقية	b u q i a
بوكيمون	b u k i m u n
بولاد	b u l aː d
بولس	b u l s
بولندا	b u l n d aː
بولندا	b u l n d aː
بولندا	b u l n d aː
بوليس	b u l i s
بوليفيا	b u l i f i aː
بومة	b u m a
بومة	b u m a
بوملي	b u m l iː
بويب	b u j b
بويت	b u j t
بيئة	b i ʔ i a
بياض	b i aː dˤ
بياض	b i aː dˤ
بيان	b i aː n
بيانات	b i aː n aː t
بيبرلماني	b i b r l m aː n iː
بيت	b i t
بيت	b i t
بيت	b i t
بيتزا	b i t z aː
بيتزا	b i t z aː
بيتزا	b i t z aː
بيتزا	b i t z aː
بيجادق	b i dʒ aː d q
بيجادي	b i dʒ aː d iː
بيجاذق	b i dʒ aː ð q
بيجاذي	b i dʒ aː ð iː
بيد	b i d
بيداء	b i d aː ʔ
بيدر	b i d r
بيدق	b i d q
بيرق	b i r q
بيرم	b i r m
بيرو	b i r uː
بيروت	b i r u t
بيروقراطي	b i r u q r aː tˤ iː
بيسوس	b i s u s
بيش	b i ʃ
بيشاور	b i ʃ aː w r
بيشوي	b i ʃ u iː
بيض	b i dˤ
بيض	b i dˤ
بيض	b i dˤ
بيضة	b i dˤ a
بيطرة	b i tˤ r a
بيع	b i ʕ
بيعة	b i ʕ a
بيعة	b i ʕ a
بيفام	b i f aː m
بيقية	b i q i a
بيكار	b i k aː r
بيلادونا	b i l aː d u n aː
بيلاروس	b i l aː r u s
بيلاروسي	b i l aː r u s iː
بيلاروسيا	b i l aː r u s i aː
بيلاروسيا	b i l aː r u s i aː
بيلقان	b i l q aː n
بين	b i n
بينما	b i n m aː
بينيت	b i n i t
بينيت	b i n i t
بينيث	b i n i θ
بينيث	b i n i θ
بيوت	b i w t
بيوزاري	b i w z aː r iː
ة	a
ة	a
ت	t
ت	t
تأبض	t ʔ a b dˤ
تأبط	t ʔ a b tˤ
تأبق	t ʔ a b q
تأتى	t ʔ a t aː
تأثرات	t ʔ a θ r aː t
تأثير	t ʔ a θ i r
تأجير	t ʔ a dʒ i r
تأخير	t ʔ a x i r
تأذين	t ʔ a ð i n
تأرجح	t ʔ a r dʒ ħ
تأسف	t ʔ a s f
تأسف	t ʔ a s f
تأسيس	t ʔ a s i s
تأقلم	t ʔ a q l m
تأكيد	t ʔ a k i d
تأكيدا	t ʔ a k i d aː
تألب	t ʔ a l b
تألف	t ʔ a l f
تألق	t ʔ a l q
تألق	t ʔ a l q
تأمرك	t ʔ a m r k
تأمور	t ʔ a m u r
تأموري	t ʔ a m u r iː
تأمى	t ʔ a m aː
تأمير	t ʔ a m i r
تأميم	t ʔ a m i m
تأمينات	t ʔ a m i n aː t
تأنجل	t ʔ a n dʒ l
تأنق	t ʔ a n q
تأنى	t ʔ a n aː
تأهل	t ʔ a h l
تأوه	t ʔ a u h
تأوه	t ʔ a u h
تأييد	t ʔ a i j d
تاء	t aː ʔ
تاب	t aː b
تابل	t aː b l
تابل	t aː b l
تابوت	t aː b u t
تاج	t aː dʒ
تاجر	t aː dʒ r
تاجورة	t aː dʒ u r a
تاجي	t aː dʒ iː
تارة	t aː r a
تارة	t aː r a
تاريخ	t aː r i x
تاريخا	t aː r i x aː
تاريخي	t aː r i x iː
تاريخية	t aː r i x i a
تازة	t aː z a
تاسع	t aː s ʕ
تافه	t aː f h
تاق	t aː q
تاك	t aː k
تاكسي	t aː k s iː
تال	t aː l
تالله	t aː l l h
تالي	t aː l iː
تامول	t aː m u l
تانبول	t aː n b u l
تاوريرت	t aː w r i r t
تايلاند	t aː j l aː n d
تايلند	t aː j l n d
تايلندي	t aː j l n d iː
تايوان	t aː j w aː n
تب	t b
تبادر	t b aː d r
تبارى	t b aː r aː
تباطأ	t b aː tˤ ʔ a
تباعد	t b aː ʕ d
تباعد	t b aː ʕ d
تباكى	t b aː k aː
تباهى	t b aː h aː
تباين	t b aː j n
تباين	t b aː j n
تبجيل	t b dʒ i l
تبحر	t b ħ r
تبدع	t b d ʕ
تبديد	t b d i d
تبرع	t b r ʕ
تبرع	t b r ʕ
تبرم	t b r m
تبرى	t b r aː
تبرير	t b r i r
تبريز	t b r i z
تبشير	t b ʃ i r
تبصير	t b sˤ i r
تبع	t b ʕ
