ء	ʔ
آ	ʔ aː
آبد	ʔ aː b d
آبلة	ʔ aː b l a
آبيس	ʔ aː b i s
آتشيوت	ʔ aː t ʃ i w t
آتشيوت	ʔ aː t ʃ i w t
آتون	ʔ aː t u n
آثار	ʔ aː θ aː r
آثام	ʔ aː θ aː m
آح	ʔ aː ħ
آخر	ʔ aː x r
آخر	ʔ aː x r
آخرة	ʔ aː x r a
آخرة	ʔ aː x r a
آخن	ʔ aː x n
آدب	ʔ aː d b
آدم	ʔ aː d m
آدمي	ʔ aː d m iː
آذان	ʔ aː ð aː n
آذريون	ʔ aː ð r i w n
آذى	ʔ aː ð aː
آس	ʔ aː s
آسف	ʔ aː s f
آسف	ʔ aː s f
آسفي	ʔ aː s f iː
آسيوي	ʔ aː s i w iː
آش	ʔ aː ʃ
آشوري	ʔ aː ʃ u r iː
آصف	ʔ aː sˤ f
آصف	ʔ aː sˤ f
آفات	ʔ aː f aː t
آفة	ʔ aː f a
آفرین	ʔ aː f r n
آل	ʔ aː l
آل	ʔ aː l
آل	ʔ aː l
آلات	ʔ aː l aː t
آلاف	ʔ aː l aː f
آلة	ʔ aː l a
آلف	ʔ aː l f
آلي	ʔ aː l iː
آلية	ʔ aː l i a
آمال	ʔ aː m aː l
آمن	ʔ aː m n
آمن	ʔ aː m n
آمن	ʔ aː m n
آمن	ʔ aː m n
آمن	ʔ aː m n
آمن	ʔ aː m n
آمن	ʔ aː m n
آمنة	ʔ aː m n a
آمون	ʔ aː m u n
آمين	ʔ aː m i n
آنسة	ʔ aː n s a
آنك	ʔ aː n k
آنى	ʔ aː n aː
آني	ʔ aː n iː
آية	ʔ aː j a
آيسلندا	ʔ aː j s l n d aː
آيوا	ʔ aː j w aː
أ	ʔ a
أ	ʔ a
أ	ʔ a
أب	ʔ a b
أباجور	ʔ a b aː dʒ u r
أباح	ʔ a b aː ħ
أباخس	ʔ a b aː x s
أباد	ʔ a b aː d
أباريق	ʔ a b aː r i q
أباس	ʔ a b aː s
أباسخيرون	ʔ a b aː s x i r u n
أبان	ʔ a b aː n
أبتر	ʔ a b t r
أبث	ʔ a b θ
أبخازيا	ʔ a b x aː z i aː
أبخق	ʔ a b x q
أبد	ʔ a b d
أبد	ʔ a b d
أبد	ʔ a b d
أبد	ʔ a b d
أبدا	ʔ a b d aː
أبدة	ʔ a b d a
أبدى	ʔ a b d aː
أبدي	ʔ a b d iː
أبدي	ʔ a b d iː
أبدية	ʔ a b d i a
أبذة	ʔ a b ð a
أبر	ʔ a b r
أبر	ʔ a b r
أبرز	ʔ a b r z
أبرز	ʔ a b r z
أبرز	ʔ a b r z
أبرز	ʔ a b r z
أبرم	ʔ a b r m
أبريل	ʔ a b r i l
أبسطة	ʔ a b s tˤ a
أبش	ʔ a b ʃ
أبش	ʔ a b ʃ
أبطل	ʔ a b tˤ l
أبكم	ʔ a b k m
أبلس	ʔ a b l s
أبلق	ʔ a b l q
أبله	ʔ a b l h
أبنوس	ʔ a b n u s
أبنوس	ʔ a b n u s
أبها	ʔ a b h aː
أبهة	ʔ a b h a
أبهج	ʔ a b h dʒ
أبوان	ʔ a b u aː n
أبوة	ʔ a b u a
أبوت	ʔ a b u t
أبود	ʔ a b u d
أبيدجان	ʔ a b i d dʒ aː n
أبيض	ʔ a b i dˤ
أتاح	ʔ a t aː ħ
أترج	ʔ a t r dʒ
أتقن	ʔ a t q n
أتلف	ʔ a t l f
أتمت	ʔ a t m t
أتوبوس	ʔ a t u b u s
أتوبيس	ʔ a t u b i s
أتوم	ʔ a t u m
أتون	ʔ a t u n
أتى	ʔ a t aː
أثاث	ʔ a θ aː θ
أثث	ʔ a θ θ
أثجل	ʔ a θ dʒ l
أثرة	ʔ a θ r a
أثرة	ʔ a θ r a
أثرة	ʔ a θ r a
أثقال	ʔ a θ q aː l
أثل	ʔ a θ l
أثل	ʔ a θ l
أثل	ʔ a θ l
أثل	ʔ a θ l
أثلج	ʔ a θ l dʒ
أثم	ʔ a θ m
أثناء	ʔ a θ n aː ʔ
أثناء	ʔ a θ n aː ʔ
أثنى	ʔ a θ n aː
أثيم	ʔ a θ i m
أثينا	ʔ a θ i n aː
أثيوبيا	ʔ a θ i w b i aː
أثيوبيا	ʔ a θ i w b i aː
أثيوبيا	ʔ a θ i w b i aː
أثيوبيا	ʔ a θ i w b i aː
أثيوبيا	ʔ a θ i w b i aː
أجاب	ʔ a dʒ aː b
أجاب	ʔ a dʒ aː b
أجار	ʔ a dʒ aː r
أجدب	ʔ a dʒ d b
أجدع	ʔ a dʒ d ʕ
أجذاع	ʔ a dʒ ð aː ʕ
أجرب	ʔ a dʒ r b
أجرد	ʔ a dʒ r d
أجزاء	ʔ a dʒ z aː ʔ
أجش	ʔ a dʒ ʃ
أجل	ʔ a dʒ l
أجل	ʔ a dʒ l
أجل	ʔ a dʒ l
أجل	ʔ a dʒ l
أجلح	ʔ a dʒ l ħ
أجلى	ʔ a dʒ l aː
أجمة	ʔ a dʒ m a
أجمع	ʔ a dʒ m ʕ
أجمع	ʔ a dʒ m ʕ
أجمعون	ʔ a dʒ m ʕ u n
أجمعين	ʔ a dʒ m ʕ i n
أجنبي	ʔ a dʒ n b iː
أجنبيات	ʔ a dʒ n b i aː t
أجندة	ʔ a dʒ n d a
أجهد	ʔ a dʒ h d
أجهض	ʔ a dʒ h dˤ
أجوف	ʔ a dʒ u f
أجيال	ʔ a dʒ i aː l
أجير	ʔ a dʒ i r
أجير	ʔ a dʒ i r
أجير	ʔ a dʒ i r
أحادي	ʔ a ħ aː d iː
أحاسيس	ʔ a ħ aː s i s
أحاط	ʔ a ħ aː tˤ
أحاط	ʔ a ħ aː tˤ
أحاط	ʔ a ħ aː tˤ
أحب	ʔ a ħ b
أحب	ʔ a ħ b
أحبك	ʔ a ħ b k
أحبك	ʔ a ħ b k
أحجم	ʔ a ħ dʒ m
أحجية	ʔ a ħ dʒ i a
أحجية	ʔ a ħ dʒ i a
أحد	ʔ a ħ d
أحد	ʔ a ħ d
أحرج	ʔ a ħ r dʒ
أحرش	ʔ a ħ r ʃ
أحسن	ʔ a ħ s n
أحسن	ʔ a ħ s n
أحسن	ʔ a ħ s n
أحسن	ʔ a ħ s n
أحسن	ʔ a ħ s n
أحسن	ʔ a ħ s n
أحسن	ʔ a ħ s n
أحسن	ʔ a ħ s n
أحسن	ʔ a ħ s n
أحسن	ʔ a ħ s n
أحسن	ʔ a ħ s n
أحصن	ʔ a ħ sˤ n
أحصى	ʔ a ħ sˤ aː
أحمر	ʔ a ħ m r
أحمق	ʔ a ħ m q
أحنك	ʔ a ħ n k
أحوج	ʔ a ħ u dʒ
أحور	ʔ a ħ u r
أحول	ʔ a ħ u l
أحيلى	ʔ a ħ i l aː
أخ	ʔ a x
أخاديد	ʔ a x aː d i d
أخاذ	ʔ a x aː ð
أخامص	ʔ a x aː m sˤ
أخبر	ʔ a x b r
أخت	ʔ a x t
أخثاث	ʔ a x θ aː θ
أخدر	ʔ a x d r
أخدر	ʔ a x d r
أخدود	ʔ a x d u d
أخذ	ʔ a x ð
أخذ	ʔ a x ð
أخذ	ʔ a x ð
أخرس	ʔ a x r s
أخرس	ʔ a x r s
أخرى	ʔ a x r aː
أخشن	ʔ a x ʃ n
أخصائي	ʔ a x sˤ aː ʔ i iː
أخصر	ʔ a x sˤ r
أخضر	ʔ a x dˤ r
أخطأ	ʔ a x tˤ ʔ a
أخطبوط	ʔ a x tˤ b u tˤ
أخطبوط	ʔ a x tˤ b u tˤ
أخلاط	ʔ a x l aː tˤ
أخلاق	ʔ a x l aː q
أخلاقي	ʔ a x l aː q iː
أخلاقية	ʔ a x l aː q i a
أخمص	ʔ a x m sˤ
أخوة	ʔ a x u a
أخوية	ʔ a x u j a
أخياط	ʔ a x i aː tˤ
أخيرى	ʔ a x i r aː
أداة	ʔ a d aː a
أدار	ʔ a d aː r
أداف	ʔ a d aː f
أدان	ʔ a d aː n
أدب	ʔ a d b
أدب	ʔ a d b
أدبة	ʔ a d b a
أدبي	ʔ a d b iː
أدبي	ʔ a d b iː
أدبيا	ʔ a d b i aː
أدبيات	ʔ a d b i aː t
أدجى	ʔ a d dʒ aː
أدحوة	ʔ a d ħ u a
أدحية	ʔ a d ħ i a
أدحية	ʔ a d ħ i a
أدرك	ʔ a d r k
أدرنة	ʔ a d r n a
أدكن	ʔ a d k n
أدلة	ʔ a d l a
أدلج	ʔ a d l dʒ
أدمن	ʔ a d m n
أدهش	ʔ a d h ʃ
أدهش	ʔ a d h ʃ
أدهش	ʔ a d h ʃ
أدهش	ʔ a d h ʃ
أدهش	ʔ a d h ʃ
أدهش	ʔ a d h ʃ
أدهش	ʔ a d h ʃ
أدهش	ʔ a d h ʃ
أدهم	ʔ a d h m
أدوية	ʔ a d u j a
أدى	ʔ a d aː
أديب	ʔ a d i b
أديبة	ʔ a d i b a
أذاع	ʔ a ð aː ʕ
أذانة	ʔ a ð aː n a
أذر	ʔ a ð r
أذربيجان	ʔ a ð r b i dʒ aː n
أذربيجان	ʔ a ð r b i dʒ aː n
أذربيجاني	ʔ a ð r b i dʒ aː n iː
أذربيجانية	ʔ a ð r b i dʒ aː n i a
أذري	ʔ a ð r iː
أذرية	ʔ a ð r i a
أذعن	ʔ a ð ʕ n
أذن	ʔ a ð n
أذن	ʔ a ð n
أذن	ʔ a ð n
أذن	ʔ a ð n
أذن	ʔ a ð n
أذن	ʔ a ð n
أذى	ʔ a ð aː
أذية	ʔ a ð i a
أراد	ʔ a r aː d
أربعة	ʔ a r b ʕ a
أربعة	ʔ a r b ʕ a
أربعون	ʔ a r b ʕ u n
أربيل	ʔ a r b i l
أرثوذكس	ʔ a r θ u ð k s
أرثوذكسي	ʔ a r θ u ð k s iː
أرثوذكسية	ʔ a r θ u ð k s i a
أرجأ	ʔ a r dʒ ʔ a
أرجان	ʔ a r dʒ aː n
أرجواني	ʔ a r dʒ u aː n iː
أرجواني	ʔ a r dʒ u aː n iː
أرجونة	ʔ a r dʒ u n a
أرجيش	ʔ a r dʒ i ʃ
أرح	ʔ a r ħ
أرخ	ʔ a r x
أرخبيل	ʔ a r x b i l
أردف	ʔ a r d f
أردمون	ʔ a r d m u n
أردني	ʔ a r d n iː
أردني	ʔ a r d n iː
أردى	ʔ a r d aː
أرز	ʔ a r z
أرز	ʔ a r z
أرز	ʔ a r z
أرز	ʔ a r z
أرستقراطي	ʔ a r s t q r aː tˤ iː
أرستقراطية	ʔ a r s t q r aː tˤ i a
أرسطو	ʔ a r s tˤ uː
أرسطوطاليس	ʔ a r s tˤ u tˤ aː l i s
أرسل	ʔ a r s l
أرشذونة	ʔ a r ʃ ð u n a
أرشيدوق	ʔ a r ʃ i d u q
أرشيدوقة	ʔ a r ʃ i d u q a
أرشيدوقية	ʔ a r ʃ i d u q i a
أرصفة	ʔ a r sˤ f a
أرض	ʔ a r dˤ
أرضة	ʔ a r dˤ a
أرضي	ʔ a r dˤ iː
أرضية	ʔ a r dˤ i a
أرعب	ʔ a r ʕ b
أرغان	ʔ a r ɣ aː n
أرغفة	ʔ a r ɣ f a
أرقان	ʔ a r q aː n
أرقان	ʔ a r q aː n
أركان	ʔ a r k aː n
أركش	ʔ a r k ʃ
أركن	ʔ a r k n
أركنساس	ʔ a r k n s aː s
أركون	ʔ a r k u n
أرم	ʔ a r m
أرم	ʔ a r m
أرمل	ʔ a r m l
أرمل	ʔ a r m l
أرملة	ʔ a r m l a
أرمن	ʔ a r m n
أرمية	ʔ a r m i a
أرمية	ʔ a r m i a
أرمينيا	ʔ a r m i n i aː
أرنؤدي	ʔ a r n ʔ u d iː
أرنب	ʔ a r n b
أرنيط	ʔ a r n i tˤ
أرهب	ʔ a r h b
أرهق	ʔ a r h q
أرواح	ʔ a r u aː ħ
أروفى	ʔ a r u f aː
أرومة	ʔ a r u m a
أرومة	ʔ a r u m a
أرومية	ʔ a r u m i a
أريج	ʔ a r i dʒ
أريحا	ʔ a r i ħ aː
أريزونا	ʔ a r i z u n aː
أريكا	ʔ a r i k aː
أريكة	ʔ a r i k a
أزأم	ʔ a z ʔ a m
أزاح	ʔ a z aː ħ
أزادرخت	ʔ a z aː d r x t
أزب	ʔ a z b
أزدرخت	ʔ a z d r x t
أزرع	ʔ a z r ʕ
أزرق	ʔ a z r q
أزعج	ʔ a z ʕ dʒ
أزعر	ʔ a z ʕ r
أزعل	ʔ a z ʕ l
أزل	ʔ a z l
أزل	ʔ a z l
أزلي	ʔ a z l iː
أسارون	ʔ a s aː r u n
أساس	ʔ a s aː s
أساسا	ʔ a s aː s aː
أساسي	ʔ a s aː s iː
أساسيا	ʔ a s aː s i aː
أسامة	ʔ a s aː m a
أسباب	ʔ a s b aː b
أسباط	ʔ a s b aː tˤ
أسبوع	ʔ a s b u ʕ
أسبوعي	ʔ a s b u ʕ iː
أستاذ	ʔ a s t aː ð
أستاذ	ʔ a s t aː ð
أستاذ	ʔ a s t aː ð
أستانا	ʔ a s t aː n aː
أستجة	ʔ a s t dʒ a
أسترالي	ʔ a s t r aː l iː
أستراليا	ʔ a s t r aː l i aː
أسترقة	ʔ a s t r q a
أستير	ʔ a s t i r
أسد	ʔ a s d
أسرب	ʔ a s r b
أسرة	ʔ a s r a
أسرة	ʔ a s r a
أسري	ʔ a s r iː
أسس	ʔ a s s
أسطرك	ʔ a s tˤ r k
أسطرلاب	ʔ a s tˤ r l aː b
أسطمة	ʔ a s tˤ m a
أسطوانة	ʔ a s tˤ u aː n a
أسطوخودس	ʔ a s tˤ u x u d s
أسطوخودوس	ʔ a s tˤ u x u d u s
أسطورة	ʔ a s tˤ u r a
أسطوري	ʔ a s tˤ u r iː
أسطول	ʔ a s tˤ u l
أسف	ʔ a s f
أسف	ʔ a s f
أسفاراج	ʔ a s f aː r aː dʒ
أسفر	ʔ a s f r
أسفراج	ʔ a s f r aː dʒ
أسفع	ʔ a s f ʕ
أسفلت	ʔ a s f l t
أسفنيك	ʔ a s f n i k
أسقف	ʔ a s q f
أسقف	ʔ a s q f
أسقف	ʔ a s q f
أسقف	ʔ a s q f
أسقى	ʔ a s q aː
أسكفة	ʔ a s k f a
أسكيدنيا	ʔ a s k i d n i aː
أسلوب	ʔ a s l u b
أسلي	ʔ a s l iː
أسماء	ʔ a s m aː ʔ
أسمر	ʔ a s m r
أسمرا	ʔ a s m r aː
أسمرة	ʔ a s m r a
أسهر	ʔ a s h r
أسهل	ʔ a s h l
أسهل	ʔ a s h l
أسهل	ʔ a s h l
أسهل	ʔ a s h l
أسهل	ʔ a s h l
أسهل	ʔ a s h l
أسهل	ʔ a s h l
أسهل	ʔ a s h l
أسهل	ʔ a s h l
أسهل	ʔ a s h l
أسوأ	ʔ a s u ʔ a
أسوة	ʔ a s u a
أسود	ʔ a s u d
أسود	ʔ a s u d
أسى	ʔ a s aː
أسياخ	ʔ a s i aː x
أسيتون	ʔ a s i t u n
أسير	ʔ a s i r
أسيف	ʔ a s i f
أشابة	ʔ a ʃ aː b a
أشار	ʔ a ʃ aː r
أشبع	ʔ a ʃ b ʕ
أشترغار	ʔ a ʃ t r ɣ aː r
أشخص	ʔ a ʃ x sˤ
أشد	ʔ a ʃ d
أشد	ʔ a ʃ d
أشرس	ʔ a ʃ r s
أشرفي	ʔ a ʃ r f iː
أشعث	ʔ a ʃ ʕ θ
أشعل	ʔ a ʃ ʕ l
أشعل	ʔ a ʃ ʕ l
أشقر	ʔ a ʃ q r
أشكال	ʔ a ʃ k aː l
أشكل	ʔ a ʃ k l
أشل	ʔ a ʃ l
أشل	ʔ a ʃ l
أشل	ʔ a ʃ l
أشم	ʔ a ʃ m
أشم	ʔ a ʃ m
أشمط	ʔ a ʃ m tˤ
أشنان	ʔ a ʃ n aː n
أشنة	ʔ a ʃ n a
أشهب	ʔ a ʃ h b
أشهد	ʔ a ʃ h d
أشهل	ʔ a ʃ h l
أشوس	ʔ a ʃ u s
أشول	ʔ a ʃ u l
أشوه	ʔ a ʃ u h
أشيب	ʔ a ʃ i b
أصأب	ʔ a sˤ ʔ a b
أصاخ	ʔ a sˤ aː x
أصبح	ʔ a sˤ b ħ
أصحاب	ʔ a sˤ ħ aː b
أصحاح	ʔ a sˤ ħ aː ħ
أصحى	ʔ a sˤ ħ aː
أصخد	ʔ a sˤ x d
أصخر	ʔ a sˤ x r
أصدأ	ʔ a sˤ d ʔ a
أصطرك	ʔ a sˤ tˤ r k
أصطماخيقون	ʔ a sˤ tˤ m aː x i q u n
أصطمخيقون	ʔ a sˤ tˤ m x i q u n
أصغى	ʔ a sˤ ɣ aː
أصف	ʔ a sˤ f
أصفاد	ʔ a sˤ f aː d
أصفر	ʔ a sˤ f r
أصفر	ʔ a sˤ f r
أصفهان	ʔ a sˤ f h aː n
أصفى	ʔ a sˤ f aː
أصفى	ʔ a sˤ f aː
أصل	ʔ a sˤ l
أصل	ʔ a sˤ l
أصل	ʔ a sˤ l
أصلا	ʔ a sˤ l aː
أصلع	ʔ a sˤ l ʕ
أصم	ʔ a sˤ m
أصهب	ʔ a sˤ h b
أصهب	ʔ a sˤ h b
أصوات	ʔ a sˤ u aː t
أصواتي	ʔ a sˤ u aː t iː
أصيص	ʔ a sˤ i sˤ
أصيل	ʔ a sˤ i l
أضاع	ʔ a dˤ aː ʕ
أضاف	ʔ a dˤ aː f
أضبط	ʔ a dˤ b tˤ
أضبط	ʔ a dˤ b tˤ
أضر	ʔ a dˤ r
أضفى	ʔ a dˤ f aː
أضمر	ʔ a dˤ m r
أضمر	ʔ a dˤ m r
أطاح	ʔ a tˤ aː ħ
أطاق	ʔ a tˤ aː q
أطباء	ʔ a tˤ b aː ʔ
أطبة	ʔ a tˤ b a
أطر	ʔ a tˤ r
أطر	ʔ a tˤ r
أطراف	ʔ a tˤ r aː f
أطرش	ʔ a tˤ r ʃ
أطروحة	ʔ a tˤ r u ħ a
أطعم	ʔ a tˤ ʕ m
أطفال	ʔ a tˤ f aː l
أطل	ʔ a tˤ l
أطلس	ʔ a tˤ l s
أطلسي	ʔ a tˤ l s iː
أطلع	ʔ a tˤ l ʕ
أطلق	ʔ a tˤ l q
أطنب	ʔ a tˤ n b
أطيان	ʔ a tˤ i aː n
أظفور	ʔ a ðˤ f u r
أظمأ	ʔ a ðˤ m ʔ a
أعاجيب	ʔ a ʕ aː dʒ i b
أعار	ʔ a ʕ aː r
أعاصير	ʔ a ʕ aː sˤ i r
أعال	ʔ a ʕ aː l
أعتاب	ʔ a ʕ t aː b
أعتن	ʔ a ʕ t n
أعجم	ʔ a ʕ dʒ m
أعجمي	ʔ a ʕ dʒ m iː
أعجمي	ʔ a ʕ dʒ m iː
أعجوبة	ʔ a ʕ dʒ u b a
أعذب	ʔ a ʕ ð b
أعرج	ʔ a ʕ r dʒ
أعرن	ʔ a ʕ r n
أعز	ʔ a ʕ z
أعز	ʔ a ʕ z
أعزب	ʔ a ʕ z b
أعزل	ʔ a ʕ z l
أعشى	ʔ a ʕ ʃ aː
أعصر	ʔ a ʕ sˤ r
أعض	ʔ a ʕ dˤ
أعطاب	ʔ a ʕ tˤ aː b
أعطب	ʔ a ʕ tˤ b
أعطى	ʔ a ʕ tˤ aː
أعظ	ʔ a ʕ ðˤ
أعف	ʔ a ʕ f
أعفر	ʔ a ʕ f r
أعقد	ʔ a ʕ q d
أعل	ʔ a ʕ l
أعلن	ʔ a ʕ l n
أعلون	ʔ a ʕ l u n
أعلى	ʔ a ʕ l aː
أعلى	ʔ a ʕ l aː
أعمد	ʔ a ʕ m d
أعمدة	ʔ a ʕ m d a
أعمى	ʔ a ʕ m aː
أعمى	ʔ a ʕ m aː
أعنق	ʔ a ʕ n q
أعور	ʔ a ʕ u r
أعيا	ʔ a ʕ i aː
أعياد	ʔ a ʕ i aː d
أعيان	ʔ a ʕ i aː n
أغاث	ʔ a ɣ aː θ
أغار	ʔ a ɣ aː r
أغاريقون	ʔ a ɣ aː r i q u n
أغاظ	ʔ a ɣ aː ðˤ
أغافت	ʔ a ɣ aː f t
أغافث	ʔ a ɣ aː f θ
أغبر	ʔ a ɣ b r
أغرق	ʔ a ɣ r q
أغرم	ʔ a ɣ r m
أغرى	ʔ a ɣ r aː
أغسطس	ʔ a ɣ s tˤ s
أغشت	ʔ a ɣ ʃ t
أغضب	ʔ a ɣ dˤ b
أغضى	ʔ a ɣ dˤ aː
أغلب	ʔ a ɣ l b
أغلب	ʔ a ɣ l b
أغلب	ʔ a ɣ l b
أغلب	ʔ a ɣ l b
أغلب	ʔ a ɣ l b
أغلب	ʔ a ɣ l b
أغلب	ʔ a ɣ l b
أغلب	ʔ a ɣ l b
أغلب	ʔ a ɣ l b
أغلب	ʔ a ɣ l b
أغلب	ʔ a ɣ l b
أغلب	ʔ a ɣ l b
أغلب	ʔ a ɣ l b
أغلب	ʔ a ɣ l b
أغلب	ʔ a ɣ l b
أغلبية	ʔ a ɣ l b i a
أغلف	ʔ a ɣ l f
أغلفة	ʔ a ɣ l f a
أغلى	ʔ a ɣ l aː
أغماد	ʔ a ɣ m aː d
أغمي	ʔ a ɣ m iː
أغنية	ʔ a ɣ n i a
أغوى	ʔ a ɣ u aː
أغيا	ʔ a ɣ i aː
أغيد	ʔ a ɣ i d
أفؤل	ʔ a f ʔ u l
أفاء	ʔ a f aː ʔ
أفاد	ʔ a f aː d
أفاويه	ʔ a f aː w j h
أفتى	ʔ a f t aː
أفتيمون	ʔ a f t i m u n
أفثيمون	ʔ a f θ i m u n
أفرد	ʔ a f r d
أفرط	ʔ a f r tˤ
أفرع	ʔ a f r ʕ
أفرع	ʔ a f r ʕ
أفرغ	ʔ a f r ɣ
أفرغ	ʔ a f r ɣ
أفريقانية	ʔ a f r i q aː n i a
أفريقيا	ʔ a f r i q i aː
أفسس	ʔ a f s s
أفسنتين	ʔ a f s n t i n
أفشرج	ʔ a f ʃ r dʒ
أفشرج	ʔ a f ʃ r dʒ
أفضى	ʔ a f dˤ aː
أفطس	ʔ a f tˤ s
أفظ	ʔ a f ðˤ
أفعى	ʔ a f ʕ aː
أفغانستان	ʔ a f ɣ aː n s t aː n
أفغاني	ʔ a f ɣ aː n iː
أفقي	ʔ a f q iː
أفك	ʔ a f k
أفل	ʔ a f l
أفلاطون	ʔ a f l aː tˤ u n
أفلاطون	ʔ a f l aː tˤ u n
أفلاطوني	ʔ a f l aː tˤ u n iː
أفلس	ʔ a f l s
أفول	ʔ a f u l
أفيتمون	ʔ a f i t m u n
أفيتيمون	ʔ a f i t i m u n
أفيثمون	ʔ a f i θ m u n
أفيثيمون	ʔ a f i θ i m u n
أفيون	ʔ a f i w n
أقحم	ʔ a q ħ m
أقحوان	ʔ a q ħ u aː n
أقدر	ʔ a q d r
أقر	ʔ a q r
أقر	ʔ a q r
أقرأ	ʔ a q r ʔ a
أقران	ʔ a q r aː n
أقرب	ʔ a q r b
أقرب	ʔ a q r b
أقرباء	ʔ a q r b aː ʔ
أقرع	ʔ a q r ʕ
أقضب	ʔ a q dˤ b
أقضى	ʔ a q dˤ aː
أقضى	ʔ a q dˤ aː
أقط	ʔ a q tˤ
أقط	ʔ a q tˤ
أقعب	ʔ a q ʕ b
أقلف	ʔ a q l f
أقلية	ʔ a q l i a
أقنث	ʔ a q n θ
أقنثا	ʔ a q n θ aː
أقنع	ʔ a q n ʕ
أك	ʔ a k
أكادير	ʔ a k aː d i r
أكاديمي	ʔ a k aː d i m iː
أكاديمية	ʔ a k aː d i m i a
أكاذيب	ʔ a k aː ð i b
أكار	ʔ a k aː r
أكاف	ʔ a k aː f
أكاف	ʔ a k aː f
أكال	ʔ a k aː l
أكب	ʔ a k b
أكتوبر	ʔ a k t u b r
أكتوبر	ʔ a k t u b r
أكتوبر	ʔ a k t u b r
أكتوبر	ʔ a k t u b r
أكثرية	ʔ a k θ r i a
أكدر	ʔ a k d r
أكرمي	ʔ a k r m iː
أكره	ʔ a k r h
أكرى	ʔ a k r aː
أكسجين	ʔ a k s dʒ i n
أكسح	ʔ a k s ħ
أكسد	ʔ a k s d
أكسدة	ʔ a k s d a
أكسيد	ʔ a k s i d
أكشف	ʔ a k ʃ f
أكل	ʔ a k l
أكل	ʔ a k l
أكل	ʔ a k l
أكل	ʔ a k l
أكل	ʔ a k l
أكل	ʔ a k l
أكمة	ʔ a k m a
أكمون	ʔ a k m u n
أكو	ʔ a k uː
أكيد	ʔ a k i d
ألا	ʔ a l aː
ألا	ʔ a l aː
ألاباما	ʔ a l aː b aː m aː
ألاسكا	ʔ a l aː s k aː
ألباني	ʔ a l b aː n iː
ألبانيا	ʔ a l b aː n i aː
ألبسة	ʔ a l b s a
ألتائي	ʔ a l t aː ʔ i iː
ألتاي	ʔ a l t aː iː
ألح	ʔ a l ħ
ألحد	ʔ a l ħ d
ألغاز	ʔ a l ɣ aː z
ألغى	ʔ a l ɣ aː
ألف	ʔ a l f
ألفبائي	ʔ a l f b aː ʔ i iː
ألفية	ʔ a l f i a
ألفين	ʔ a l f i n
ألفين	ʔ a l f i n
ألقى	ʔ a l q aː
ألكسندروس	ʔ a l k s n d r u s
ألم	ʔ a l m
ألماتي	ʔ a l m aː t iː
ألماس	ʔ a l m aː s
ألماني	ʔ a l m aː n iː
ألمانيا	ʔ a l m aː n i aː
ألمح	ʔ a l m ħ
ألنجج	ʔ a l n dʒ dʒ
ألنجوج	ʔ a l n dʒ u dʒ
أله	ʔ a l h
ألهى	ʔ a l h aː
ألوان	ʔ a l u aː n
ألوة	ʔ a l u a
ألوة	ʔ a l u a
ألوهية	ʔ a l u h i a
ألية	ʔ a l i a
ألية	ʔ a l i a
أليس	ʔ a l i s
أليس	ʔ a l i s
أليف	ʔ a l i f
أم	ʔ a m
أم	ʔ a m
أم	ʔ a m
أما	ʔ a m aː
أما	ʔ a m aː
أمات	ʔ a m aː t
أمازيغ	ʔ a m aː z i ɣ
أمازيغي	ʔ a m aː z i ɣ iː
أمازيغية	ʔ a m aː z i ɣ i a
أمال	ʔ a m aː l
أمام	ʔ a m aː m
أمامي	ʔ a m aː m iː
أمان	ʔ a m aː n
أمانة	ʔ a m aː n a
أمدمي	ʔ a m d m iː
أمذريان	ʔ a m ð r i aː n
أمراء	ʔ a m r aː ʔ
أمريكا	ʔ a m r i k aː
أمريكة	ʔ a m r i k a
أمريكي	ʔ a m r i k iː
أمس	ʔ a m s
أمس	ʔ a m s
أمس	ʔ a m s
أمس	ʔ a m s
أمس	ʔ a m s
أمس	ʔ a m s
أمس	ʔ a m s
أمس	ʔ a m s
أمستردام	ʔ a m s t r d aː m
أمسك	ʔ a m s k
أمسوخ	ʔ a m s u x
أمسوخ	ʔ a m s u x
أمصوخ	ʔ a m sˤ u x
أمصوخ	ʔ a m sˤ u x
أمضى	ʔ a m dˤ aː
أمغر	ʔ a m ɣ r
أمغر	ʔ a m ɣ r
أمكن	ʔ a m k n
أملج	ʔ a m l dʒ
أملس	ʔ a m l s
أممي	ʔ a m m iː
أممي	ʔ a m m iː
أمنى	ʔ a m n aː
أمهري	ʔ a m h r iː
أمهل	ʔ a m h l
أمومة	ʔ a m u m a
أموي	ʔ a m u iː
أمي	ʔ a m iː
أمي	ʔ a m iː
أميبا	ʔ a m i b aː
أميبي	ʔ a m i b iː
أمير	ʔ a m i r
أميرة	ʔ a m i r a
أميركي	ʔ a m i r k iː
أميل	ʔ a m i l
أمينة	ʔ a m i n a
أن	ʔ a n
أن	ʔ a n
أن	ʔ a n
أنأى	ʔ a n ʔ a aː
أنا	ʔ a n aː
أنا	ʔ a n aː
أناء	ʔ a n aː ʔ
أناخ	ʔ a n aː x
أناس	ʔ a n aː s
أناغالس	ʔ a n aː ɣ aː l s
أناغاليس	ʔ a n aː ɣ aː l i s
أناغلس	ʔ a n aː ɣ l s
أناقة	ʔ a n aː q a
أناني	ʔ a n aː n iː
أنباء	ʔ a n b aː ʔ
أنباض	ʔ a n b aː dˤ
أنبج	ʔ a n b dʒ
أنبج	ʔ a n b dʒ
أنبذ	ʔ a n b ð
أنبوب	ʔ a n b u b
أنبوبة	ʔ a n b u b a
أنبيق	ʔ a n b i q
أنت	ʔ a n t
أنت	ʔ a n t
أنت	ʔ a n t
أنتاركتيكا	ʔ a n t aː r k t i k aː
أنتج	ʔ a n t dʒ
أنتم	ʔ a n t m
أنتما	ʔ a n t m aː
أنتن	ʔ a n t n
أنتيكخانة	ʔ a n t i k x aː n a
أنثوي	ʔ a n θ u iː
أنثى	ʔ a n θ aː
أنجدان	ʔ a n dʒ d aː n
أنجرة	ʔ a n dʒ r a
أنجرة	ʔ a n dʒ r a
أنجرة	ʔ a n dʒ r a
أنجم	ʔ a n dʒ m
أنجوج	ʔ a n dʒ u dʒ
أنجى	ʔ a n dʒ aː
أندر	ʔ a n d r
أندر	ʔ a n d r
أندراوس	ʔ a n d r aː w s
أندلسي	ʔ a n d l s iː
أندورا	ʔ a n d u r aː
أنزروت	ʔ a n z r u t
أنزع	ʔ a n z ʕ
أنزل	ʔ a n z l
أنسجة	ʔ a n s dʒ a
أنسون	ʔ a n s u n
أنسى	ʔ a n s aː
أنصح	ʔ a n sˤ ħ
أنصف	ʔ a n sˤ f
أنضب	ʔ a n dˤ b
أنضج	ʔ a n dˤ dʒ
أنطاكية	ʔ a n tˤ aː k i a
أنطاكية	ʔ a n tˤ aː k i a
أنطاليا	ʔ a n tˤ aː l i aː
أنطالية	ʔ a n tˤ aː l i a
أنطلياس	ʔ a n tˤ l i aː s
أنطى	ʔ a n tˤ aː
أنعت	ʔ a n ʕ t
أنعل	ʔ a n ʕ l
أنعم	ʔ a n ʕ m
أنعم	ʔ a n ʕ m
أنعم	ʔ a n ʕ m
أنغولا	ʔ a n ɣ u l aː
أنغولا	ʔ a n ɣ u l aː
أنف	ʔ a n f
أنف	ʔ a n f
أنف	ʔ a n f
أنف	ʔ a n f
أنفاق	ʔ a n f aː q
أنفحة	ʔ a n f ħ a
أنفق	ʔ a n f q
أنقذ	ʔ a n q ð
أنقرة	ʔ a n q r a
أنقرديا	ʔ a n q r d i aː
أنقرديا	ʔ a n q r d i aː
أنقض	ʔ a n q dˤ
أنقض	ʔ a n q dˤ
أنقليس	ʔ a n q l i s
أنقليس	ʔ a n q l i s
أنكر	ʔ a n k r
أنما	ʔ a n m aː
أنمش	ʔ a n m ʃ
أنمص	ʔ a n m sˤ
أنملة	ʔ a n m l a
أنموذج	ʔ a n m u ð dʒ
أنهار	ʔ a n h aː r
أنهك	ʔ a n h k
أنهى	ʔ a n h aː
أنوار	ʔ a n u aː r
أنواط	ʔ a n u aː tˤ
أنواع	ʔ a n u aː ʕ
أنور	ʔ a n u r
أنوق	ʔ a n u q
أنيس	ʔ a n i s
أنيسون	ʔ a n i s u n
أنيون	ʔ a n i w n
أهاج	ʔ a h aː dʒ
أهبة	ʔ a h b a
أهداب	ʔ a h d aː b
أهدب	ʔ a h d b
أهدب	ʔ a h d b
أهدى	ʔ a h d aː
أهر	ʔ a h r
أهر	ʔ a h r
أهلا	ʔ a h l aː
أهلة	ʔ a h l a
أهلي	ʔ a h l iː
أهلية	ʔ a h l i a
أهمية	ʔ a h m i a
أهوج	ʔ a h u dʒ
أهول	ʔ a h u l
أهيف	ʔ a h i f
أو	ʔ a uː
أوان	ʔ a u aː n
أوبئة	ʔ a u b ʔ i a
أوبرا	ʔ a u b r aː
أوبرا	ʔ a u b r aː
أوبريت	ʔ a u b r i t
أوتاد	ʔ a u t aː d
أوتاوا	ʔ a u t aː w aː
أوتوستراد	ʔ a u t u s t r aː d
أوتوستراد	ʔ a u t u s t r aː d
أوتوماتيكي	ʔ a u t u m aː t i k iː
أوتيل	ʔ a u t i l
أوج	ʔ a u dʒ
أوجب	ʔ a u dʒ b
أوجب	ʔ a u dʒ b
أوجد	ʔ a u dʒ d
أوجد	ʔ a u dʒ d
أوجد	ʔ a u dʒ d
أوجد	ʔ a u dʒ d
أوجز	ʔ a u dʒ z
أوجس	ʔ a u dʒ s
أوجع	ʔ a u dʒ ʕ
أوحال	ʔ a u ħ aː l
أوحد	ʔ a u ħ d
أوحل	ʔ a u ħ l
أودى	ʔ a u d aː
أور	ʔ a u r
أوراق	ʔ a u r aː q
أورانوس	ʔ a u r aː n u s
أورانيا	ʔ a u r aː n i aː
أورانيوم	ʔ a u r aː n i w m
أوربة	ʔ a u r b a
أوربي	ʔ a u r b iː
أورشليم	ʔ a u r ʃ l i m
أوركسترا	ʔ a u r k s t r aː
أورنكزيب	ʔ a u r n k z i b
أوروبا	ʔ a u r u b aː
أوروبة	ʔ a u r u b a
أوروبي	ʔ a u r u b iː
أوروغواي	ʔ a u r u ɣ u aː iː
أورى	ʔ a u r aː
أوريغون	ʔ a u r i ɣ u n
أوريغون	ʔ a u r i ɣ u n
أوريغون	ʔ a u r i ɣ u n
أوزار	ʔ a u z aː r
أوزبكستان	ʔ a u z b k s t aː n
أوزبكستان	ʔ a u z b k s t aː n
أوساكا	ʔ a u s aː k aː
أوشك	ʔ a u ʃ k
أوصى	ʔ a u sˤ aː
أوضح	ʔ a u dˤ ħ
أوعية	ʔ a u ʕ i a
أوغندا	ʔ a u ɣ n d aː
أوقد	ʔ a u q d
أوقف	ʔ a u q f
أوقيانوسيا	ʔ a u q i aː n u s i aː
أوقية	ʔ a u q i a
أوقية	ʔ a u q i a
أوكراني	ʔ a u k r aː n iː
أوكرانيا	ʔ a u k r aː n i aː
أوكلاهوما	ʔ a u k l aː h u m aː
أوكلاهوما	ʔ a u k l aː h u m aː
أوكيناوا	ʔ a u k i n aː w aː
أول	ʔ a u l
أولئك	ʔ a u l ʔ i k
أولا	ʔ a u l aː
أولاد	ʔ a u l aː d
أولمبي	ʔ a u l m b iː
أولو	ʔ a u l uː
أولوية	ʔ a u l u j a
أولى	ʔ a u l aː
أولى	ʔ a u l aː
أولى	ʔ a u l aː
أولي	ʔ a u l iː
أولي	ʔ a u l iː
أولياء	ʔ a u l i aː ʔ
أونتاريو	ʔ a u n t aː r i uː
أونسة	ʔ a u n s a
أونصة	ʔ a u n sˤ a
أويغور	ʔ a u j ɣ u r
أويغورستان	ʔ a u j ɣ u r s t aː n
أي	ʔ a iː
أي	ʔ a iː
أياد	ʔ a i aː d
أيام	ʔ a i aː m
أية	ʔ a i a
أيدع	ʔ a i d ʕ
أيرلندا	ʔ a i r l n d aː
أيش	ʔ a i ʃ
أيقاظ	ʔ a i q aː ðˤ
أيقظ	ʔ a i q ðˤ
أيقن	ʔ a i q n
أيل	ʔ a i l
أيل	ʔ a i l
أيل	ʔ a i l
أيلول	ʔ a i l u l
أيمان	ʔ a i m aː n
أين	ʔ a i n
أين	ʔ a i n
أين	ʔ a i n
أيهقان	ʔ a i h q aː n
أيهقان	ʔ a i h q aː n
أيوب	ʔ a i w b
أيوب	ʔ a i w b
أيوبي	ʔ a i w b iː
أيون	ʔ a i w n
ؤ	ʔ u
ؤ	ʔ u
إ	ʔ i
إباءة	ʔ i b aː ʔ a
إباحة	ʔ i b aː ħ a
إباحي	ʔ i b aː ħ iː
إباحية	ʔ i b aː ħ i a
إبادة	ʔ i b aː d a
إباضية	ʔ i b aː dˤ i a
إبالة	ʔ i b aː l a
إبالة	ʔ i b aː l a
إبان	ʔ i b aː n
إبان	ʔ i b aː n
إبتات	ʔ i b t aː t
إبجال	ʔ i b dʒ aː l
إبداع	ʔ i b d aː ʕ
إبداعي	ʔ i b d aː ʕ iː
إبراز	ʔ i b r aː z
إبراهيم	ʔ i b r aː h i m
إبرة	ʔ i b r a
إبريز	ʔ i b r i z
إبريسم	ʔ i b r i s m
إبريق	ʔ i b r i q
إبريق	ʔ i b r i q
إبريل	ʔ i b r i l
إبزيم	ʔ i b z i m
إبصار	ʔ i b sˤ aː r
إبط	ʔ i b tˤ
إبطاء	ʔ i b tˤ aː ʔ
إبطال	ʔ i b tˤ aː l
إبعاد	ʔ i b ʕ aː d
إبل	ʔ i b l
إبليز	ʔ i b l i z
إبليس	ʔ i b l i s
إبليسي	ʔ i b l i s iː
إبيقوري	ʔ i b i q u r iː
إتاحة	ʔ i t aː ħ a
إتاوة	ʔ i t aː w a
إتقان	ʔ i t q aː n
إتلاف	ʔ i t l aː f
