ء	ʔ
قنطرة	q n tˤ r a
قنطور	q n tˤ u r
قنطوريون	q n tˤ u r i w n
قنفذ	q n f ð
قنوء	q n u ʔ
قنوط	q n u tˤ
قنوم	q n u m
قنيبرة	q n i b r a
قنينة	q n i n a
قهر	q h r
قهر	q h r
قهقه	q h q h
قهقهة	q h q h a
قهوة	q h u a
قهوة	q h u a
قهوة	q h u a
قهوة	q h u a
قهوة	q h u a
قهوة	q h u a
قهوة	q h u a
قواد	q u aː d
قواد	q u aː d
قواد	q u aː d
قواد	q u aː d
قواذف	q u aː ð f
قواس	q u aː s
قواطع	q u aː tˤ ʕ
قواميس	q u aː m i s
قوة	q u a
قوت	q u t
قورح	q u r ħ
قوس	q u s
قوس	q u s
قوس	q u s
قوش	q u ʃ
قوصرة	q u sˤ r a
قوض	q u dˤ
قوطي	q u tˤ iː
قوق	q u q
قوق	q u q
قوقا	q u q aː
قوقع	q u q ʕ
قوقعة	q u q ʕ a
قول	q u l
قولنج	q u l n dʒ
قولنج	q u l n dʒ
قوم	q u m
قومية	q u m i a
قونقة	q u n q a
قونكة	q u n k a
قونية	q u n i a
قوي	q u iː
قوي	q u iː
قويعدة	q u j ʕ d a
قياسا	q i aː s aː
قياسي	q i aː s iː
قياصرة	q i aː sˤ r a
قيافة	q i aː f a
قيام	q i aː m
قيامة	q i aː m a
قيامة	q i aː m a
قيان	q i aː n
قيتار	q i t aː r
قيتارة	q i t aː r a
قيثار	q i θ aː r
قيثارات	q i θ aː r aː t
قيثارة	q i θ aː r a
قيح	q i ħ
قيدام	q i d aː m
قيدوم	q i d u m
قيراط	q i r aː tˤ
قيرغيزستان	q i r ɣ i z s t aː n
قيشور	q i ʃ u r
قيصر	q i sˤ r
قيصري	q i sˤ r iː
قيصري	q i sˤ r iː
قيصوم	q i sˤ u m
قيطون	q i tˤ u n
قيطون	q i tˤ u n
قيطون	q i tˤ u n
قيطون	q i tˤ u n
قيطون	q i tˤ u n
قيطون	q i tˤ u n
قيطون	q i tˤ u n
قيطون	q i tˤ u n
قيطون	q i tˤ u n
قيطون	q i tˤ u n
قيطون	q i tˤ u n
قيطون	q i tˤ u n
قيطون	q i tˤ u n
قيظ	q i ðˤ
قيقب	q i q b
قيلولة	q i l u l a
قيمة	q i m a
قينة	q i n a
قيوم	q i w m
ك	k
ك	k
ك	k
كآبة	k ʔ aː b a
كأب	k ʔ a b
كأس	k ʔ a s
كأن	k ʔ a n
كائن	k aː ʔ i n
كائنات	k aː ʔ i n aː t
كابتشينو	k aː b t ʃ i n uː
كابتشينو	k aː b t ʃ i n uː
كابتشينو	k aː b t ʃ i n uː
كابل	k aː b l
كابلي	k aː b l iː
كابوس	k aː b u s
كابول	k aː b u l
كاتب	k aː t b
كاتب	k aː t b
كاتدرائية	k aː t d r aː ʔ i i a
كاتيون	k aː t i w n
كاثوليك	k aː θ u l i k
كاحل	k aː ħ l
كادس	k aː d s
كاذب	k aː ð b
كاذي	k aː ð iː
كاراتيه	k aː r aː t i h
كاراطي	k aː r aː tˤ iː
كارة	k aː r a
كارى	k aː r aː
كازاخستان	k aː z aː x s t aː n
كازخستان	k aː z x s t aː n
كازون	k aː z u n
كاسيت	k aː s i t
كاشف	k aː ʃ f
كاشف	k aː ʃ f
كاشم	k aː ʃ m
كاشم	k aː ʃ m
كاعب	k aː ʕ b
كاغد	k aː ɣ d
كاغد	k aː ɣ d
كاغذ	k aː ɣ ð
كاغذ	k aː ɣ ð
كاغيد	k aː ɣ i d
كاف	k aː f
كاف	k aː f
كافأ	k aː f ʔ a
كافتيريا	k aː f t i r i aː
كافتيريا	k aː f t i r i aː
كافح	k aː f ħ
كافر	k aː f r
كافور	k aː f u r
كاكنج	k aː k n dʒ
كالون	k aː l u n
كالينينغراد	k aː l i n i n ɣ r aː d
كالينينغراد	k aː l i n i n ɣ r aː d
كامبودي	k aː m b u d iː
كامبوديا	k aː m b u d i aː
كامخ	k aː m x
كامخ	k aː m x
كامرا	k aː m r aː
كامل	k aː m l
كاميرا	k aː m i r aː
كان	k aː n
كانبرا	k aː n b r aː
كانون	k aː n u n
كاهنة	k aː h n a
كباب	k b aː b
كبابة	k b aː b a
كبابة	k b aː b a
كباث	k b aː θ
كبد	k b d
كبد	k b d
كبر	k b r
كبراء	k b r aː ʔ
كبرياء	k b r i aː ʔ
كبريت	k b r i t
كبست	k b s t
كبش	k b ʃ
كبكب	k b k b
كبل	k b l
كبل	k b l
كبوسين	k b u s i n
كبير	k b i r
كبير	k b i r
كبيرة	k b i r a
كبيس	k b i s
كبيكج	k b i k dʒ
كتاب	k t aː b
كتاب	k t aː b
كتابة	k t aː b a
كتابخانة	k t aː b x aː n a
كتان	k t aː n
كتب	k t b
كتب	k t b
كتب	k t b
كتب	k t b
كتف	k t f
كتف	k t f
كتلة	k t l a
كتيب	k t i b
كتيبات	k t i b aː t
كثافة	k θ aː f a
كثرة	k θ r a
كثيب	k θ i b
كثير	k θ i r
كثيرا	k θ i r aː
كثيرا	k θ i r aː
كثيراء	k θ i r aː ʔ
كثيف	k θ i f
كجرات	k dʒ r aː t
كحلاء	k ħ l aː ʔ
كحلي	k ħ l iː
كحلي	k ħ l iː
كدس	k d s
كدس	k d s
كدس	k d s
كدين	k d i n
كذاب	k ð aː b
كذاب	k ð aː b
كذاب	k ð aː b
كذين	k ð i n
كذينق	k ð i n q
كراث	k r aː θ
كراث	k r aː θ
كراج	k r aː dʒ
كراج	k r aː dʒ
كراخة	k r aː x a
كراز	k r aː z
كراز	k r aː z
كراز	k r aː z
كراسة	k r aː s a
كراكوف	k r aː k u f
كرامة	k r aː m a
كراميل	k r aː m i l
كراني	k r aː n iː
كراويا	k r aː w j aː
كراوية	k r aː w j a
كرباج	k r b aː dʒ
كرباج	k r b aː dʒ
كرباس	k r b aː s
كربة	k r b a
كربون	k r b u n
كربون	k r b u n
كرة	k r a
كرة	k r a
كرج	k r dʒ
كرج	k r dʒ
كرج	k r dʒ
كرج	k r dʒ
كرج	k r dʒ
كرج	k r dʒ
كرح	k r ħ
كرخ	k r x
كردون	k r d u n
كرز	k r z
كرزم	k r z m
كرزم	k r z m
كرزن	k r z n
كرزن	k r z n
كرزيم	k r z i m
كرزين	k r z i n
كرس	k r s
كرس	k r s
كرسف	k r s f
كرسوع	k r s u ʕ
كرسي	k r s iː
كرشب	k r ʃ b
كرفس	k r f s
كرفس	k r f s
كرك	k r k
كركم	k r k m
كركند	k r k n d
كرنب	k r n b
كرنتينة	k r n t i n a
كرنيب	k r n i b
كرنيب	k r n i b
كره	k r h
كره	k r h
كره	k r h
كره	k r h
كره	k r h
كره	k r h
كرها	k r h aː
كرواتي	k r u aː t iː
كرواتيا	k r u aː t i aː
كروياء	k r u j aː ʔ
كروية	k r u j a
كروية	k r u j a
كرياس	k r i aː s
كريستوفر	k r i s t u f r
كريم	k r i m
كريم	k r i m
كريم	k r i m
كريم	k r i m
كزاز	k z aː z
كزاز	k z aː z
كزبرة	k z b r a
كزبرة	k z b r a
كزمازج	k z m aː z dʒ
كزمازق	k z m aː z q
كزمازك	k z m aː z k
كس	k s
كسا	k s aː
كساء	k s aː ʔ
كساح	k s aː ħ
كسارة	k s aː r a
كسبة	k s b a
كستبان	k s t b aː n
كستج	k s t dʒ
كستج	k s t dʒ
كستج	k s t dʒ
كستيج	k s t i dʒ
كسحاء	k s ħ aː ʔ
كسر	k s r
كسرة	k s r a
كسل	k s l
كسوة	k s u a
كسوة	k s u a
كسوف	k s u f
كسيح	k s i ħ
كشتاسب	k ʃ t aː s b
كشتبان	k ʃ t b aː n
كشح	k ʃ ħ
كشمش	k ʃ m ʃ
كشمير	k ʃ m i r
كشنى	k ʃ n aː
كشوت	k ʃ u t
كشوث	k ʃ u θ
كعبة	k ʕ b a
كعبتين	k ʕ b t i n
كعك	k ʕ k
كعكة	k ʕ k a
كفات	k f aː t
كفاح	k f aː ħ
كفالة	k f aː l a
كفاية	k f aː j a
كفت	k f t
كفروا	k f r u aː
كفرية	k f r i a
كفكف	k f k f
كفى	k f aː
كل	k l
كل	k l
كلأ	k l ʔ a
كلاشنكوف	k l aː ʃ n k u f
كلب	k l b
كلبة	k l b a
كلبيات	k l b i aː t
كلح	k l ħ
كلخ	k l x
كلفة	k l f a
كلك	k l k
كلكلانج	k l k l aː n dʒ
كلما	k l m aː
كلمة	k l m a
كلميم	k l m i m
كلوتة	k l u t a
كلوتة	k l u t a
كلي	k l iː
كليات	k l i aː t
كليب	k l i b
كلية	k l i a
كلية	k l i a
كليل	k l i l
كليم	k l i m
كم	k m
كم	k m
كم	k m
كمء	k m ʔ
كمأ	k m ʔ a
كمأة	k m ʔ a a
كماة	k m aː a
كماشير	k m aː ʃ i r
كمال	k m aː l
كمام	k m aː m
كمامة	k m aː m a
كمان	k m aː n
كمبيوتر	k m b i w t r
كمت	k m t
كمت	k m t
كمت	k m t
كمت	k m t
كمت	k m t
كمتة	k m t a
كمثراة	k m θ r aː a
كمثرى	k m θ r aː
كمح	k m ħ
كمر	k m r
كمن	k m n
كمون	k m u n
كمي	k m iː
كميت	k m i t
كميل	k m i l
كميل	k m i l
كميون	k m i w n
كميون	k m i w n
كن	k n
كن	k n
كن	k n
كن	k n
كنا	k n aː
كناب	k n aː b
كنار	k n aː r
كنارة	k n aː r a
كنارة	k n aː r a
كناسة	k n aː s a
كناسة	k n aː s a
كناية	k n aː j a
كنباث	k n b aː θ
كنباث	k n b aː θ
كنتم	k n t m
كنثة	k n θ a
كندا	k n d aː
كندر	k n d r
كندرة	k n d r a
كندرة	k n d r a
كندس	k n d s
كندش	k n d ʃ
كندوج	k n d u dʒ
كنز	k n z
كنز	k n z
كنز	k n z
كنزة	k n z a
كنعان	k n ʕ aː n
كنغر	k n ɣ r
كنغر	k n ɣ r
كنف	k n f
كنف	k n f
كنى	k n aː
كنى	k n aː
كنية	k n i a
كنيسة	k n i s a
كهذا	k h ð aː
كهرب	k h r b
كهرب	k h r b
كهرباء	k h r b aː ʔ
كهرباء	k h r b aː ʔ
كهرمان	k h r m aː n
كهرو	k h r uː
كهروتقني	k h r u t q n iː
كهروحراري	k h r u ħ r aː r iː
كهروساكن	k h r u s aː k n
كهروستاتيكي	k h r u s t aː t i k iː
كهروسكوني	k h r u s k u n iː
كهروضوئي	k h r u dˤ u ʔ i iː
كهرومائي	k h r u m aː ʔ i iː
كهرومتحرك	k h r u m t ħ r k
كهرومغناطيسي	k h r u m ɣ n aː tˤ i s iː
كهرومنزلي	k h r u m n z l iː
كهف	k h f
كهف	k h f
كهنايا	k h n aː j aː
كهنوت	k h n u t
كوابيس	k u aː b i s
كواعب	k u aː ʕ b
كواكب	k u aː k b
كوالا	k u aː l aː
كوب	k u b
كوبا	k u b aː
كوبنهاجن	k u b n h aː dʒ n
كوبنهاجن	k u b n h aː dʒ n
كوبنهاغن	k u b n h aː ɣ n
كوبنهاغن	k u b n h aː ɣ n
كوة	k u a
كوة	k u a
كوثر	k u θ r
كوثر	k u θ r
كوثل	k u θ l
كوج	k u dʒ
كوخ	k u x
كودن	k u d n
كودين	k u d i n
كوذين	k u ð i n
كورال	k u r aː l
كورال	k u r aː l
كورة	k u r a
كوريا	k u r i aː
كوريا	k u r i aː
كوز	k u z
كوس	k u s
كوس	k u s
كوسا	k u s aː
كوستاريكا	k u s t aː r i k aː
كوسج	k u s dʒ
كوسوفو	k u s u f uː
كوسى	k u s aː
كوشاد	k u ʃ aː d
كوع	k u ʕ
كوكب	k u k b
كوكبة	k u k b a
كولان	k u l aː n
كولان	k u l aː n
كولومبو	k u l u m b uː
كولومبو	k u l u m b uː
كولومبيا	k u l u m b i aː
كوم	k u m
كوم	k u m
كوميلا	k u m i l aː
كون	k u n
كون	k u n
كونت	k u n t
كونتية	k u n t i a
كونسرفاتوار	k u n s r f aː t u aː r
كونيغسبرغ	k u n i ɣ s b r ɣ
كونيغسبرغ	k u n i ɣ s b r ɣ
كويكب	k u j k b
كياسة	k i aː s a
كيبك	k i b k
كيد	k i d
كيرلس	k i r l s
كيريباتي	k i r i b aː t iː
كيزون	k i z u n
كيسنجر	k i s n dʒ r
كيشيناو	k i ʃ i n aː uː
كيشينيف	k i ʃ i n i f
كيف	k i f
كيف	k i f
كيف	k i f
كيلوجرام	k i l u dʒ r aː m
كيلوجرام	k i l u dʒ r aː m
كيلوغرام	k i l u ɣ r aː m
كيلوغرام	k i l u ɣ r aː m
كيلومتر	k i l u m t r
كيمياء	k i m i aː ʔ
كينيا	k i n i aː
كينيا	k i n i aː
كيول	k i w l
كييف	k i j f
كييف	k i j f
ل	l
ل	l
ل	l
ل	l
ل	l
لأك	l ʔ a k
لألأ	l ʔ a l ʔ a
لأن	l ʔ a n
لأن	l ʔ a n
لأى	l ʔ a aː
لأى	l ʔ a aː
لأي	l ʔ a iː
لؤلؤ	l ʔ u l ʔ u
لؤلؤ	l ʔ u l ʔ u
لؤلؤة	l ʔ u l ʔ u a
لؤي	l ʔ u iː
لئلا	l ʔ i l aː
لئيم	l ʔ i i m
لا	l aː
لاءم	l aː ʔ m
لاأدري	l aː ʔ a d r iː
لائحة	l aː ʔ i ħ a
لائق	l aː ʔ i q
لائكية	l aː ʔ i k i a
لاتفي	l aː t f iː
لاتفي	l aː t f iː
لاتفيا	l aː t f i aː
لاتفيا	l aː t f i aː
لاث	l aː θ
لاج	l aː dʒ
لاج	l aː dʒ
لاح	l aː ħ
لاحق	l aː ħ q
لاحق	l aː ħ q
لاحم	l aː ħ m
لادن	l aː d n
لاذ	l aː ð
لاذن	l aː ð n
لازوردي	l aː z u r d iː
لاسلطوي	l aː s l tˤ u iː
لاسلطوية	l aː s l tˤ u j a
لاسلكي	l aː s l k iː
لاشعوري	l aː ʃ ʕ u r iː
لاشعوريا	l aː ʃ ʕ u r i aː
لاشى	l aː ʃ aː
لاط	l aː tˤ
لاطف	l aː tˤ f
لاطف	l aː tˤ f
لاعب	l aː ʕ b
لاعب	l aː ʕ b
لاعية	l aː ʕ i a
لاغب	l aː ɣ b
لاغية	l aː ɣ i a
لافتة	l aː f t a
لام	l aː m
لام	l aː m
لامبالاة	l aː m b aː l aː a
لاهاي	l aː h aː iː
لاهوت	l aː h u t
لاهوتي	l aː h u t iː
لاهور	l aː h u r
لاوس	l aː w s
لاوس	l aː w s
لاوعي	l aː w ʕ iː
لاوى	l aː w aː
لبأ	l b ʔ a
لبادة	l b aː d a
لبادة	l b aː d a
لباس	l b aː s
لبان	l b aː n
لبان	l b aː n
لبس	l b s
لبسة	l b s a
لبلاب	l b l aː b
لبلابي	l b l aː b iː
لبلبي	l b l b iː
لبن	l b n
لبنان	l b n aː n
لبني	l b n iː
لبوس	l b u s
لبى	l b aː
لتواني	l t u aː n iː
لتواني	l t u aː n iː
لتوانيا	l t u aː n i aː
لثة	l θ a
لثغة	l θ ɣ a
لثم	l θ m
لثوي	l θ u iː
لج	l dʒ
لج	l dʒ
لجأ	l dʒ ʔ a
لجأة	l dʒ ʔ a a
لجئ	l dʒ ʔ i
لجام	l dʒ aː m
لجلج	l dʒ l dʒ
لجنة	l dʒ n a
لجنة	l dʒ n a
لجنة	l dʒ n a
لجوء	l dʒ u ʔ
لجي	l dʒ iː
لجين	l dʒ i n
لحاء	l ħ aː ʔ
لحاظ	l ħ aː ðˤ
لحاف	l ħ aː f
لحاق	l ħ aː q
لحج	l ħ dʒ
لحج	l ħ dʒ
لحد	l ħ d
لحظ	l ħ ðˤ
لحظ	l ħ ðˤ
لحظة	l ħ ðˤ a
لحظتذاك	l ħ ðˤ t ð aː k
لحظي	l ħ ðˤ iː
لحق	l ħ q
لحق	l ħ q
لحلاح	l ħ l aː ħ
لحم	l ħ m
لحوج	l ħ u dʒ
لحي	l ħ iː
لحية	l ħ i a
لدغ	l d ɣ
لذلك	l ð l k
لذيذ	l ð i ð
لزاق	l z aː q
لزج	l z dʒ
لزج	l z dʒ
لزق	l z q
لزق	l z q
لزق	l z q
لزوجة	l z u dʒ a
لسان	l s aː n
لسانيات	l s aː n i aː t
لسع	l s ʕ
لشبونة	l ʃ b u n a
لص	l sˤ
لصاق	l sˤ aː q
لصف	l sˤ f
لصق	l sˤ q
لصق	l sˤ q
لطافة	l tˤ aː f a
لطفا	l tˤ f aː
لطم	l tˤ m
لطيف	l tˤ i f
لطيفة	l tˤ i f a
لعب	l ʕ b
لعبة	l ʕ b a
لعبة	l ʕ b a
لعل	l ʕ l
لعل	l ʕ l
لعلما	l ʕ l m aː
لعنة	l ʕ n a
لغة	l ɣ a
لغط	l ɣ tˤ
لغط	l ɣ tˤ
لغويات	l ɣ u j aː t
لفافة	l f aː f a
لفظا	l f ðˤ aː
لفظة	l f ðˤ a
لفظي	l f ðˤ iː
لفف	l f f
لفيف	l f i f
لفيف	l f i f
لفيفة	l f i f a
لقاح	l q aː ħ
لقاح	l q aː ħ
لقب	l q b
لقب	l q b
لقح	l q ħ
لقد	l q d
لقمان	l q m aː n
لقمة	l q m a
لقنت	l q n t
لقوة	l q u a
لقيا	l q i aː
لقيمة	l q i m a
لك	l k
لكز	l k z
لكز	l k z
لكم	l k m
لكمة	l k m a
لكن	l k n
لكن	l k n
لكنة	l k n a
لكنما	l k n m aː
للأسف	l l ʔ a s f
للغاية	l l ɣ aː j a
لله	l l h
لله	l l h
لله	l l h
لم	l m
لم	l m
لم	l m
لماذا	l m aː ð aː
لمح	l m ħ
لمح	l m ħ
لمس	l m s
لمع	l m ʕ
لمع	l m ʕ
لمعان	l m ʕ aː n
لمن	l m n
لمن	l m n
لمن	l m n
لمى	l m aː
لمى	l m aː
لن	l n
لندن	l n d n
لندن	l n d n
لندني	l n d n iː
لندني	l n d n iː
لها	l h aː
لهاة	l h aː a
لهاث	l h aː θ
لهب	l h b
لهب	l h b
لهب	l h b
لهبان	l h b aː n
لهبان	l h b aː n
لهث	l h θ
لهجة	l h dʒ a
لهجة	l h dʒ a
لهجة	l h dʒ a
لهجة	l h dʒ a
لهجة	l h dʒ a
لهذا	l h ð aː
لهفة	l h f a
لهق	l h q
لهوي	l h u iː
لهى	l h aː
لهي	l h iː
لهيب	l h i b
لو	l uː
لواء	l u aː ʔ
لواء	l u aː ʔ
لواط	l u aː tˤ
لوح	l u ħ
لوح	l u ħ
لوحة	l u ħ a
لورد	l u r d
لوز	l u z
لوزينج	l u z i n dʒ
لوزينق	l u z i n q
لوسيل	l u s i l
لوط	l u tˤ
لوطي	l u tˤ iː
لوعة	l u ʕ a
لوكسمبورغ	l u k s m b u r ɣ
لوكسمبورغ	l u k s m b u r ɣ
لوكسمبورغ	l u k s m b u r ɣ
لولا	l u l aː
لوما	l u m aː
لومي	l u m iː
لومي	l u m iː
لون	l u n
لون	l u n
لونيات	l u n i aː t
لونية	l u n i a
لوى	l u aː
لوياثان	l u j aː θ aː n
ليال	l i aː l
ليبيا	l i b i aː
ليبيريا	l i b i r i aː
لية	l i a
ليت	l i t
ليتما	l i t m aː
ليث	l i θ
ليختنشتاين	l i x t n ʃ t aː j n
ليرة	l i r a
ليرون	l i r u n
ليرون	l i r u n
ليزر	l i z r
ليزر	l i z r
ليس	l i s
ليس	l i s
ليسوتو	l i s u t uː
ليل	l i l
ليلا	l i l aː
ليلة	l i l a
ليلتذاك	l i l t ð aː k
ليلك	l i l k
ليلك	l i l k
ليلى	l i l aː
ليلي	l i l iː
ليمو	l i m uː
ليمو	l i m uː
ليمون	l i m u n
ليموني	l i m u n iː
ليمي	l i m iː
لينينية	l i n i n i a
م	m
م	m
مآزق	m ʔ aː z q
مأجوج	m ʔ a dʒ u dʒ
مأجور	m ʔ a dʒ u r
مأدبة	m ʔ a d b a
مأذون	m ʔ a ð u n
مأرب	m ʔ a r b
مأزق	m ʔ a z q
مأساة	m ʔ a s aː a
مأساة	m ʔ a s aː a
مأقى	m ʔ a q aː
مأكول	m ʔ a k u l
مأكولات	m ʔ a k u l aː t
مأمأة	m ʔ a m ʔ a a
مأمن	m ʔ a m n
مأمور	m ʔ a m u r
مأوى	m ʔ a u aː
مؤاجرة	m ʔ u aː dʒ r a
مؤاخاة	m ʔ u aː x aː a
مؤامرة	m ʔ u aː m r a
مؤبد	m ʔ u b d
مؤبد	m ʔ u b d
مؤتمر	m ʔ u t m r
مؤثر	m ʔ u θ r
مؤثر	m ʔ u θ r
مؤدب	m ʔ u d b
مؤدب	m ʔ u d b
مؤذن	m ʔ u ð n
مؤسس	m ʔ u s s
مؤسس	m ʔ u s s
مؤسسة	m ʔ u s s a
مؤسسة	m ʔ u s s a
مؤسف	m ʔ u s f
مؤشر	m ʔ u ʃ r
مؤقتا	m ʔ u q t aː
مؤلف	m ʔ u l f
مؤلف	m ʔ u l f
مؤمن	m ʔ u m n
مؤمن	m ʔ u m n
مؤمنشاهي	m ʔ u m n ʃ aː h iː
مؤنث	m ʔ u n θ
مؤنس	m ʔ u n s
مئبر	m ʔ i b r
مئة	m ʔ i a
مئذنة	m ʔ i ð n a
مئق	m ʔ i q
ما	m aː
ماء	m aː ʔ
ماء	m aː ʔ
مائة	m aː ʔ i a
مائة	m aː ʔ i a
مائت	m aː ʔ i t
مائدة	m aː ʔ i d a
مائل	m aː ʔ i l
مائي	m aː ʔ i iː
مات	m aː t
مات	m aː t
ماثل	m aː θ l
ماجد	m aː dʒ d
ماجور	m aː dʒ u r
ماحق	m aː ħ q
ماخور	m aː x u r
مادة	m aː d a
ماديا	m aː d i aː
ماذا	m aː ð aː
مار	m aː r
مار	m aː r
مار	m aː r
ماردين	m aː r d i n
ماردين	m aː r d i n
ماردين	m aː r d i n
مارس	m aː r s
مارس	m aː r s
مارس	m aː r s
مارطو	m aː r tˤ uː
ماركة	m aː r k a
ماركسية	m aː r k s i a
ماركسية	m aː r k s i a
مارون	m aː r u n
مارون	m aː r u n
ماز	m aː z
مازج	m aː z dʒ
مازريون	m aː z r i w n
مازريون	m aː z r i w n
مازوت	m aː z u t
مازوخية	m aː z u x i a
مازوكية	m aː z u k i a
ماسة	m aː s a
ماسح	m aː s ħ
ماسورة	m aː s u r a
ماسوشية	m aː s u ʃ i a
ماشية	m aː ʃ i a
ماض	m aː dˤ
ماطل	m aː tˤ l
ماعون	m aː ʕ u n
ماعونة	m aː ʕ u n a
ماكر	m aː k r
مال	m aː l
مال	m aː l
مالاوي	m aː l aː w iː
مالج	m aː l dʒ
مالح	m aː l ħ
مالديفز	m aː l d i f z
مالطا	m aː l tˤ aː
مالطا	m aː l tˤ aː
مالطا	m aː l tˤ aː
مالطا	m aː l tˤ aː
مالطي	m aː l tˤ iː
مالق	m aː l q
مالقة	m aː l q a
مالك	m aː l k
مالكي	m aː l k iː
مالي	m aː l iː
مالية	m aː l i a
ماليزيا	m aː l i z i aː
ماما	m aː m aː
ماموث	m aː m u θ
ماميثا	m aː m i θ aː
ماميران	m aː m i r aː n
مان	m aː n
مانشيت	m aː n ʃ i t
مانشيت	m aː n ʃ i t
مانشيت	m aː n ʃ i t
مانيلا	m aː n i l aː
ماه	m aː h
ماهاراجا	m aː h aː r aː dʒ aː
ماهر	m aː h r
ماهية	m aː h i a
ماو	m aː uː
ماوي	m aː w iː
ماي	m aː iː
مايه	m aː j h
مايو	m aː j uː
مباح	m b aː ħ
مباحثة	m b aː ħ θ a
مبادرة	m b aː d r a
مباراة	m b aː r aː a
مبارز	m b aː r z
مبارز	m b aː r z
مبارزة	m b aː r z a
مبارك	m b aː r k
مبارك	m b aː r k
مباغت	m b aː ɣ t
مباغت	m b aː ɣ t
مباغتة	m b aː ɣ t a
مباغتة	m b aː ɣ t a
مبالغة	m b aː l ɣ a
مبتل	m b t l
مبتلى	m b t l aː
مبجل	m b dʒ l
مبدأ	m b d ʔ a
مبدئيا	m b d ʔ i i aː
مبذر	m b ð r
مبرة	m b r a
مبرد	m b r d
مبرد	m b r d
مبرد	m b r d
مبرهنة	m b r h n a
مبسط	m b s tˤ
مبشر	m b ʃ r
مبشرة	m b ʃ r a
مبصر	m b sˤ r
مبطل	m b tˤ l
مبكر	m b k r
مبكرا	m b k r aː
مبلغ	m b l ɣ
مبلغ	m b l ɣ
مبهم	m b h m
مبين	m b i n
مبين	m b i n
مبين	m b i n
مت	m t
متأثر	m t ʔ a θ r
متأخرا	m t ʔ a x r aː
متأسف	m t ʔ a s f
متأن	m t ʔ a n
متأهل	m t ʔ a h l
متاح	m t aː ħ
متارك	m t aː r k
متاركة	m t aː r k a
متاع	m t aː ʕ
متانة	m t aː n a
متبسم	m t b s m
متبل	m t b l
متة	m t a
متتابع	m t t aː b ʕ
متتال	m t t aː l
متجاوز	m t dʒ aː w z
متجر	m t dʒ r
متحد	m t ħ d
متحرك	m t ħ r k
متحف	m t ħ f
متحف	m t ħ f
متحكم	m t ħ k m
متحكم	m t ħ k m
متحمس	m t ħ m s
متخاصم	m t x aː sˤ m
متخصص	m t x sˤ sˤ
متخف	m t x f
متخلف	m t x l f
متخلف	m t x l f
متدافق	m t d aː f q
متدفق	m t d f q
متدين	m t d i n
متر	m t r
متراس	m t r aː s
مترجم	m t r dʒ m
مترجم	m t r dʒ m
متردد	m t r d d
متروك	m t r u k
متزاوج	m t z aː w dʒ
متزوج	m t z u dʒ
متسابق	m t s aː b q
متسامح	m t s aː m ħ
متساهل	m t s aː h l
متساو	m t s aː uː
متسلط	m t s l tˤ
متسول	m t s u l
متشابه	m t ʃ aː b h
متشكر	m t ʃ k r
متصل	m t sˤ l
متصور	m t sˤ u r
متصور	m t sˤ u r
متطرف	m t tˤ r f
متظاهر	m t ðˤ aː h r
متعاقب	m t ʕ aː q b
متعب	m t ʕ b
متعة	m t ʕ a
متعجرف	m t ʕ dʒ r f
متعد	m t ʕ d
متعدد	m t ʕ d d
متعدي	m t ʕ d iː
متعصب	m t ʕ sˤ b
متعفن	m t ʕ f n
متعقب	m t ʕ q b
متعلق	m t ʕ l q
متعلم	m t ʕ l m
متعهد	m t ʕ h d
متغلب	m t ɣ l b
متغلبة	m t ɣ l b a
متغير	m t ɣ i r
متفجرات	m t f dʒ r aː t
متفرغ	m t f r ɣ
متفرق	m t f r q
متفرقات	m t f r q aː t
متفق	m t f q
متفق	m t f q
متفكر	m t f k r
متقابل	m t q aː b l
متقاعد	m t q aː ʕ d
متكامل	m t k aː m l
متكبر	m t k b r
متكدس	m t k d s
متكلم	m t k l m
متلوث	m t l u θ
متلون	m t l u n
متماد	m t m aː d
متماد	m t m aː d
متمرد	m t m r d
متميز	m t m i z
متناسب	m t n aː s b
متناول	m t n aː w l
متناول	m t n aː w l
متنح	m t n ħ
متنزه	m t n z h
متنزه	m t n z h
متنقض	m t n q dˤ
متنوع	m t n u ʕ
متواصل	m t u aː sˤ l
متواضع	m t u aː dˤ ʕ
متوال	m t u aː l
متوج	m t u dʒ
متوسط	m t u s tˤ
متوصل	m t u sˤ l
متوفر	m t u f r
متوفى	m t u f aː
متوكل	m t u k l
متول	m t u l
متولد	m t u l d
متى	m t aː
متى	m t aː
متين	m t i n
مثابة	m θ aː b a
مثار	m θ aː r
مثال	m θ aː l
مثانة	m θ aː n a
مثبت	m θ b t
مثبت	m θ b t
مثبت	m θ b t
مثبت	m θ b t
مثبط	m θ b tˤ
مثرد	m θ r d
مثرد	m θ r d
مثقال	m θ q aː l
مثقب	m θ q b
مثلا	m θ l aː
مثلث	m θ l θ
مثلجات	m θ l dʒ aː t
مثلجة	m θ l dʒ a
مثلي	m θ l iː
مثمر	m θ m r
مثنان	m θ n aː n
مثنان	m θ n aː n
مثنوي	m θ n u iː
مثنوية	m θ n u j a
مثير	m θ i r
مجادلة	m dʒ aː d l a
مجاز	m dʒ aː z
مجازاة	m dʒ aː z aː a
مجازر	m dʒ aː z r
مجازفة	m dʒ aː z f a
مجازي	m dʒ aː z iː
مجازيا	m dʒ aː z i aː
مجاعة	m dʒ aː ʕ a
مجال	m dʒ aː l
مجالد	m dʒ aː l d
مجاهد	m dʒ aː h d
مجاهر	m dʒ aː h r
مجاهرة	m dʒ aː h r a
مجاور	m dʒ aː w r
مجبور	m dʒ b u r
مجدد	m dʒ d d
مجددا	m dʒ d d aː
مجر	m dʒ r
مجراف	m dʒ r aː f
مجرب	m dʒ r b
مجرة	m dʒ r a
مجرد	m dʒ r d
مجرفة	m dʒ r f a
مجرم	m dʒ r m
مجري	m dʒ r iː
مجري	m dʒ r iː
مجريط	m dʒ r i tˤ
مجزر	m dʒ z r
مجزرة	m dʒ z r a
مجس	m dʒ s
مجس	m dʒ s
مجس	m dʒ s
مجسم	m dʒ s m
مجسمة	m dʒ s m a
مجفل	m dʒ f l
مجفل	m dʒ f l
مجل	m dʒ l
مجل	m dʒ l
مجلة	m dʒ l a
مجلخة	m dʒ l x a
مجلس	m dʒ l s
مجلى	m dʒ l aː
مجمد	m dʒ m d
مجمر	m dʒ m r
مجمر	m dʒ m r
مجمع	m dʒ m ʕ
مجمع	m dʒ m ʕ
مجموع	m dʒ m u ʕ
مجموعة	m dʒ m u ʕ a
مجن	m dʒ n
مجنون	m dʒ n u n
مجنون	m dʒ n u n
مجنون	m dʒ n u n
مجهر	m dʒ h r
مجهز	m dʒ h z
مجهود	m dʒ h u d
مجهور	m dʒ h u r
مجوهرات	m dʒ u h r aː t
مجيء	m dʒ i ʔ
محا	m ħ aː
محادث	m ħ aː d θ
محادث	m ħ aː d θ
محادثة	m ħ aː d θ a
محادثة	m ħ aː d θ a
محاذاة	m ħ aː ð aː a
محار	m ħ aː r
محارب	m ħ aː r b
محاربة	m ħ aː r b a
محاسبة	m ħ aː s b a
محاصر	m ħ aː sˤ r
محاصر	m ħ aː sˤ r
محاصرة	m ħ aː sˤ r a
محاضر	m ħ aː dˤ r
محاضر	m ħ aː dˤ r
محافظ	m ħ aː f ðˤ
محافظ	m ħ aː f ðˤ
محافظ	m ħ aː f ðˤ
محافظة	m ħ aː f ðˤ a
محافظة	m ħ aː f ðˤ a
محاق	m ħ aː q
محاق	m ħ aː q
محاق	m ħ aː q
محاق	m ħ aː q
محاقر	m ħ aː q r
محاكمة	m ħ aː k m a
محام	m ħ aː m
محاور	m ħ aː w r
محاور	m ħ aː w r
محاولة	m ħ aː w l a
محايد	m ħ aː j d
محب	m ħ b
محب	m ħ b
محبة	m ħ b a
محبة	m ħ b a
محبة	m ħ b a
محبس	m ħ b s
محبس	m ħ b s
محبس	m ħ b s
محبوس	m ħ b u s
محتاج	m ħ t aː dʒ
محتار	m ħ t aː r
محترف	m ħ t r f
محترم	m ħ t r m
محترم	m ħ t r m
محتشم	m ħ t ʃ m
محتكر	m ħ t k r
محتمل	m ħ t m l
محتويات	m ħ t u j aː t
محجم	m ħ dʒ m
محجمة	m ħ dʒ m a
محجوب	m ħ dʒ u b
محدث	m ħ d θ
محدلة	m ħ d l a
محدود	m ħ d u d
